DDI-DrugBank.d241.s3.p46	in clinical trials flolan was used with digoxin diuretics anticoagulants oral vasodilators and supplemental oxygen in a pharmacokinetic substudy in patients with congestive heart failure receiving drug or digoxin in whom therapy with drug was initiated apparent oral clearance values for furosemide n and digoxin n were decreased by and respectively on the second day of therapy and had returned to baseline values by day 	DDI-mechanism
DDI-DrugBank.d123.s10.p0	this time window is different than for other oral formulations of drug which are usually administered hours before or hours after drug 	DDI-advise
DDI-DrugBank.d31.s5.p0	drug increases drug s serum concentrations 	DDI-mechanism
DDI-DrugBank.d373.s2.p14	digitalis immediate release capsules since there have been isolated reports of patients with elevated digoxin levels and there is a possible interaction between digoxin and nifedipine it is recommended that drug levels be monitored when initiating adjusting and discontinuing drug to avoid possible over or under digitalization 	DDI-advise
DDI-DrugBank.d307.s35.p2	nc denotes a mean change of less than pediatrics mean increase in adults at high trileptal doses in vivo the plasma levels of drug increased by up to when drug was given at doses above mg day 	DDI-mechanism
DDI-MedLine.d90.s7.p2	recovery of hoof twitch from to took min for atracurium alone and min for drug plus drug p 	DDI-effect
DDI-DrugBank.d179.s1.p0	drug may interact with any of the following drug e g tylenol with long term high window pane use or	DDI-int
DDI-DrugBank.d179.s1.p0	drug may interact tocopherol with any of the following drug e g tylenol with long term high dose use or	DDI-int
DDI-DrugBank.d179.s1.p0	drug may interact with any of tylenol following drug e g the with long term high dose use or	DDI-int
DDI-DrugBank.d179.s1.p0	drug may interact with any of the following drug e g tylenol with long term high dose use or	DDI-int
DDI-DrugBank.d456.s1.p7	caution should be used when administering or taking drug with ketoconazole and other strong cyp a inhibitors such as but not limited to atazanavir clarithromycin indinavir itraconazole nefazodone nelfinavir drug saquinavir telithromycin troleandomycin tao and voriconazole 	DDI-advise
DDI-DrugBank.d395.s18.p0	the oral bioavailability of drug is reduced by with coadministration of drug 	DDI-mechanism
DDI-DrugBank.d275.s3.p0	two percent of patients treated concurrently with drug and drug developed neutropenia anc x l 	DDI-effect
DDI-DrugBank.d289.s12.p0	the concomitant administration of drug and drug is contraindicated 	DDI-advise
DDI-DrugBank.d238.s2.p0	drug should not be used with drug 	DDI-advise
DDI-DrugBank.d423.s0.p2	in patients receiving nonselective drug maois e g selegiline hydrochloride in combination with drug e g fluoxetine fluvoxamine paroxetine sertraline venlafaxine there have been reports of serious sometimes fatal reactions 	DDI-effect
DDI-DrugBank.d477.s0.p0	hypertensive crises have resulted when drug have been used concomitantly within days following use of drug 	DDI-effect
DDI-MedLine.d7.s1.p0	this report describes two cases in which drug clearance accelerated markedly with concomitant drug administration 	DDI-mechanism
DDI-DrugBank.d480.s8.p13	although it has not been established that there is an interaction between clozapine and benzodiazepines or other psychotropics caution is advised when drug is initiated in patients taking a benzodiazepine or any other drug 	DDI-advise
DDI-DrugBank.d464.s0.p0	drug in combination with other drug general anesthetics phenothiazines tranquilizers sedative hypnotics or other cns depressants including alcohol has additive depressant effects 	DDI-effect
DDI-DrugBank.d175.s20.p0	if a drug is also used it may increase the risk of drug toxicity 	DDI-effect
DDI-DrugBank.d19.s9.p0	in rats simultaneous ingestion of drug and drug in the diet for weeks has been reported to cause tumors and it has been suggested that disulfiram may react with nitrites in the rat stomach to form a nitrosamine which is tumorigenic 	DDI-effect
DDI-DrugBank.d291.s6.p0	in isolated cases a pronounced though reversible impairment of renal function accompanied by a corresponding increase in the serum creatinine level has been reported in organ transplant patients receiving drug therapy and concomitant drug 	DDI-effect
DDI-DrugBank.d468.s5.p5	nicardipine hcl usually does not alter the plasma levels of digoxin however serum drug levels should be evaluated after concomitant therapy with drug is initiated 	DDI-advise
DDI-DrugBank.d514.s1.p0	in combination with other drug drug may still kill even experienced users particularly if their tolerance to the drug has reduced or the strength of their usual dose has increased 	DDI-effect
DDI-DrugBank.d246.s3.p2	however in another study in healthy volunteers the pharmacokinetics of butorphanol were significantly altered decrease in auc and decrease in cmax when a mg dose of drug was administered minute after a mg dose of drug nasal spray 	DDI-mechanism
DDI-DrugBank.d46.s16.p0	drug reduce the renal clearance of drug and add a high risk of lithium toxicity 	DDI-mechanism
DDI-DrugBank.d516.s24.p3	warfarin drug may enhance the effects of the oral drug warfarin or its derivatives 	DDI-effect
DDI-DrugBank.d566.s2.p12	cholestyramine resin may interfere with the pharmacokinetics of drugs that undergo enterohepatic circulation the discontinuance of drug resin could pose a hazard to health if a potentially toxic drug such as drug has been filtrated to a maintenance level while the patient was taking cholestyramine resin 	DDI-mechanism
DDI-MedLine.d105.s7.p1	drug had no significant impact on the cmax and auc of zidovudine although it significantly decreased the drug tmax by and increased the intracellular exposure to phosphorylated zidovudine by 	DDI-mechanism
DDI-DrugBank.d394.s0.p0	the hypotensive effect of drug is augmented by that of most other drug including ganglionic blocking agents negative inotropic agents and inhaled anesthetics 	DDI-effect
DDI-MedLine.d90.s8.p2	recovery from twitch to fade recovery took min for atracurium alone and min for drug plus drug 	DDI-effect
DDI-DrugBank.d121.s0.p0	nephrotoxicity has been reported following concomitant administration of drug and drug 	DDI-effect
DDI-DrugBank.d334.s1.p2	the possibility of hypotensive effects with prinivil can be minimized by either discontinuing the drug or increasing the salt intake prior to initiation of treatment with drug 	DDI-effect
DDI-DrugBank.d114.s8.p0	myocardial injury including myocardial infarction myocarditis ventricular hypokinesia and severe rhabdomyolysis appear to be increased in patients receiving drug and drug concurrently 	DDI-effect
DDI-DrugBank.d415.s1.p1	however because bleeding has been reported when drug and other nonsteroidal anti inflammatory agents have been administered to patients on drug the physician should be cautious when administering ibuprofen to patients on anticoagulants 	DDI-effect
DDI-DrugBank.d322.s1.p2	drug may decrease the effect of phenothiazines levodopa and drug 	DDI-effect
DDI-DrugBank.d401.s0.p1	drug interactions the central drug syndrome can occur when anticholinergic agents such as akineton are administered concomitantly with drugs that have secondary anticholinergic actions e g certain drug such as meperidine the phenothiazines and other antipsychotics tricyclic antidepressants certain antiarrhythmics such as the quinidine salts and antihistamines 	DDI-effect
DDI-DrugBank.d529.s14.p4	diuretics studies in normal volunteers have shown that drug like other nonsteroidal anti inflammatory drugs can interfere with the effects of drug 	DDI-effect
DDI-DrugBank.d499.s19.p3	probenecid drug increases both free and bound drug by reducing the plasma clearance of ketoprofen to about one third as well as decreasing its protein binding 	DDI-mechanism
DDI-DrugBank.d516.s15.p5	cyclosporine elevated serum levels of cyclosporine have been reported with concomitant use of drug with other members of the drug 	DDI-mechanism
DDI-DrugBank.d48.s1.p5	concomitant use of drug and drugs that inhibit cyp a eg ketoconazole itraconazole erythromycin clarithromycin ritonavir drug indinavir nefazodone nelfinavir saquinavir telithromycin may increase exposure to dasatinib and should be avoided 	DDI-mechanism
DDI-DrugBank.d340.s12.p0	because a similar interaction is likely drug should also not be administered concurrently with drug 	DDI-advise
DDI-DrugBank.d172.s11.p3	furosemide clinical studies as well as post marketing observations have shown that drug can reduce the natriuretic effect of drug and thiazides in some patients 	DDI-effect
DDI-DrugBank.d208.s0.p7	drug may interact medication with alcohol blood thinners decongestant drugs allergy cold and dose sinus medicines diabetic drugs lithium norepinephrine nsaids like aleve or drug and high blood pressure medications	DDI-int
DDI-DrugBank.d208.s0.p7	drug may interact with alcohol blood thinners decongestant drugs allergy cold and sinus medicines diabetic drugs lithium norepinephrine like aleve or drug and high blood pressure medications	DDI-int
DDI-DrugBank.d208.s0.p7	drug english hawthorn interact with alcohol blood thinners decongestant drugs allergy common cold and sinus medicines diabetic drugs lithium norepinephrine nsaids like aleve or drug and high blood pressure medications	DDI-int
DDI-DrugBank.d208.s0.p7	drug may interact with alcohol blood thinners decongestant drugs allergy cold and sinus medicines diabetic drugs lithium norepinephrine nsaids like aleve or drug and high blood pressure medications 	DDI-int
DDI-DrugBank.d509.s7.p0	agents that induce cyp a eg drug could cause an increase in drug clearance and lower blood levels 	DDI-mechanism
DDI-DrugBank.d467.s6.p0	concomitant administration of drug with drug capsules is not recommended 	DDI-advise
DDI-MedLine.d73.s3.p0	the drug induced neuronal damage produced a tolerance to the disruptive effects of drug and a supersensitivity to the disruptive effects of apomorphine in rats responding in a schedule controlled paradigm 	DDI-effect
DDI-DrugBank.d522.s24.p4	other drugs drug interactions have reported with administration of drug and other medications including cyclosporine hexobarbital carbamazepine alfentanil drug phenytoin bromocriptine valproate astemizole and lovastatin	DDI-int
DDI-DrugBank.d522.s24.p4	other drugs drug interactions have fundamental interaction been reported with concomitant administration of drug and other medications early including cyclosporine hexobarbital carbamazepine alfentanil drug phenytoin bromocriptine valproate astemizole and lovastatin	DDI-int
DDI-DrugBank.d522.s24.p4	other drugs drug fundamental interaction have been reported with attendant administration of drug and other medications including cyclosporine hexobarbital carbamazepine alfentanil drug phenytoin bromocriptine valproate astemizole and lovastatin	DDI-int
DDI-DrugBank.d522.s24.p4	other drugs drug interactions have been reported with concomitant administration of drug and other medications including cyclosporine hexobarbital carbamazepine alfentanil drug phenytoin bromocriptine valproate astemizole and lovastatin 	DDI-int
DDI-DrugBank.d220.s13.p0	when drug is taken concurrently with oral drug attenuation of immunization cannot be excluded 	DDI-effect
DDI-DrugBank.d347.s6.p1	the absorption of oral drug is significantly reduced by the concomitant administration of an antacid containing drug and magnesium 	DDI-mechanism
DDI-DrugBank.d544.s3.p0	total body clearance of drug was reduced by an average and when drug and mycophenolate mofetil respectively were added to a regimen consisting of cyclosporine usp modified and corticosteroids 	DDI-mechanism
DDI-DrugBank.d422.s6.p9	when intravenous morphine and brevibloc were concomitantly administered in normal subjects no effect on morphine blood levels was seen but drug steady state blood levels were increased by in the presence of drug 	DDI-mechanism
DDI-DrugBank.d469.s7.p3	drugs which may enhance the neuromuscular blocking action of drug include enflurane isoflurane halothane certain drug especially the aminoglycosides and polymyxins lithium magnesium salts procainamide and quinidine 	DDI-effect
DDI-DrugBank.d521.s1.p1	before taking drug tell your doctor if you are taking any of the following medicines aspirin or another drug such as magnesium choline salicylate trilisate salsalate disalcid others choline salicylate arthropan magnesium salicylate magan or bismuth subsalicylate pepto bismol 	DDI-advise
DDI-DrugBank.d236.s18.p2	haloperidol drug blocks dopamine and norepinephrine reuptake thus inhibiting the central stimulant effects of drug 	DDI-effect
DDI-DrugBank.d503.s5.p1	consider additive sedative effects and confusional states to emerge if drug is given with benzodiazepines or drug 	DDI-effect
DDI-DrugBank.d529.s17.p1	patients receiving drug and furosemide or other drug should be observed closely to determine if the desired effect is obtained 	DDI-advise
DDI-MedLine.d124.s1.p2	previous studies have demonstrated a significant reduction in the oral bioavailability of drug and ciprofloxacin when administered concomitantly with an intravenous opiate such as drug 	DDI-mechanism
DDI-DrugBank.d560.s1.p2	if you are also using a steroid inhaler take drug first and then wait about minutes before using the drug inhaler 	DDI-advise
DDI-DrugBank.d47.s2.p14	dopamine d receptor antagonists e g phenothiazines butyrophenones risperidone and drug may reduce the therapeutic effects of drug 	DDI-effect
DDI-DrugBank.d170.s5.p19	central nervous system depressants the concomitant use of drug fentanyl transdermal system with other central nervous system depressants including but not limited to other opioids sedatives hypnotics tranquilizers e g benzodiazepines general drug phenothiazines skeletal muscle relaxants and alcohol may cause respiratory depression hypotension and profound sedation or potentially result in coma or death 	DDI-effect
DDI-DrugBank.d202.s2.p0	in addition higher than expected steady state serum concentrations of drug have been observed when therapy is initiated in patients already taking drug 	DDI-mechanism
DDI-DrugBank.d82.s7.p0	in post marketing experience bleeding has been reported in patients on concomitant treatment with drug and drug 	DDI-effect
DDI-DrugBank.d160.s1.p0	it is recommended to avoid concurrent administration of drug with drug containing antacids for at least hours following ethambutol administration 	DDI-advise
DDI-DrugBank.d306.s0.p2	the effectiveness of drug only pills is reduced by hepatic enzyme inducing drugs such as the anticonvulsants phenytoin drug and barbiturates and the antituberculosis drug rifampin 	DDI-effect
DDI-DrugBank.d476.s3.p4	drug should be used with care when myocardial depressants or inhibitors of av conduction such as certain calcium antagonists particularly of the phenylalkylamine verapamil and drug diltiazem classes or antiarrhythmic agents such as disopyramide are used concurrently 	DDI-advise
DDI-DrugBank.d249.s18.p1	protein binding in vitro drug interferes minimally or not at all with the protein binding of salicylic acid decrease in binding drug prednisolone decrease in binding or warfarin 	DDI-mechanism
DDI-DrugBank.d171.s0.p4	drug apparently through an effect on certain microsomal enzyme systems has been reported to reduce the hepatic metabolism of warfarin type anticoagulants phenytoin propranolol nifedipine drug diazepam certain tricyclic antidepressants lidocaine theophylline and metronidazole thereby delaying elimination and increasing blood levels of these drugs 	DDI-mechanism
DDI-DrugBank.d338.s8.p4	the following are examples of drugs known to inhibit the metabolism of other related drug presumably through inhibition of cyp a nefazodone fluvoxamine cimetidine diltiazem drug and some macrolide antibiotics 	DDI-mechanism
DDI-DrugBank.d74.s0.p0	drug augments the action of drug s and the muscle relaxant effects of aminoglycosides 	DDI-effect
DDI-DrugBank.d124.s26.p134	although specific studies have not been performed coadministration with drugs that are mainly metabolized by cyp a eg calcium channel blockers dapsone disopyramide quinine amiodarone quinidine warfarin tacrolimus cyclosporine ergot derivatives pimozide carbamazepine fentanyl alfentanyl drug and triazolam may have elevated plasma concentrations when coadministered with drug 	DDI-mechanism
DDI-DrugBank.d415.s1.p4	however because bleeding has been reported when ibuprofen and other drug have been administered to patients on drug the physician should be cautious when administering ibuprofen to patients on anticoagulants 	DDI-effect
DDI-DrugBank.d48.s15.p84	therefore cyp a substrates known to have a narrow therapeutic index such as alfentanil astemizole terfenadine cisapride cyclosporine fentanyl pimozide quinidine sirolimus drug or ergot alkaloids ergotamine dihydroergotamine should be administered with caution in patients receiving drug 	DDI-advise
DDI-DrugBank.d410.s0.p5	vasoconstrictors d h e drug injection usp should not be used with drug because the combination may cause synergistic elevation of blood pressure 	DDI-effect
DDI-DrugBank.d393.s2.p0	in a multiple dose study of drug mg once daily for days and drug mg once daily for days a decrease in the clearance of cetirizine was observed 	DDI-mechanism
DDI-DrugBank.d21.s1.p0	these results would seem to dictate against the clinical use of drug with drug or during the period following elspar therapy when plasma asparagine levels are below normal 	DDI-advise
DDI-DrugBank.d537.s0.p6	drug may interact with acetaminophen e g tylenol chloramphenicol e g local anesthetics e benzocaine and drug para aminobenzoic acid paba preparations e g sunscreens and some multivitamins procainamide e g sulfonamides sulfa medicines thiazide diuretics use of these medicines during the test period will affect the test results and pancreatic supplements use of pancreatic supplements may false test results	DDI-int
DDI-DrugBank.d537.s0.p6	drug may interact with acetaminophen e g tylenol chloramphenicol e g chloromycetin local anesthetic agent e g ethyl aminobenzoate and drug para aminobenzoic acid paba containing preparations e g sunscreens and some multivitamins procainamide e g pronestyl sulpha sulfa medicines thiazide diuretics use of these medicines during the test period will bear upon the test effect and pancreatic supplements use of pancreatic supplements may commit false test effect	DDI-int
DDI-DrugBank.d537.s0.p6	drug may multivitamin interact with acetaminophen e g tylenol chloramphenicol e g chloromycetin local anesthetics e g benzocaine and drug para aminobenzoic acid paba containing preparations e g sunscreens and some multivitamins procainamide e g pronestyl sulfonamides dose sulfa medicines thiazide diuretics use tocopherol of these medicines during untrue the test period will affect the test results and pancreatic diuretic supplements use of pancreatic supplements may give ethyl aminobenzoate false test results	DDI-int
DDI-DrugBank.d537.s0.p6	drug may interact with acetaminophen e g tylenol chloramphenicol e g chloromycetin local anesthetics e g benzocaine and drug para aminobenzoic acid paba containing preparations e g sunscreens and some multivitamins procainamide e g pronestyl sulfonamides sulfa medicines thiazide diuretics use of these medicines during the test period will affect the test results and pancreatic supplements use of pancreatic supplements may give false test results 	DDI-int
DDI-DrugBank.d142.s0.p3	additive adverse effects resulting from cholinergic blockade may occur when drug is administered concomitantly with other antimuscarinics amantadine haloperidol drug monoamine oxidase mao inhibitors tricyclic antidepressants or some antihistamines 	DDI-effect
DDI-DrugBank.d9.s0.p3	drug should not be administered concomitantly with amikacin ciprofloxacin gentamicin drug or tobramycin 	DDI-advise
DDI-DrugBank.d401.s0.p3	drug interactions the central drug syndrome can occur when anticholinergic agents such as akineton are administered concomitantly with drugs that have secondary anticholinergic actions e g certain narcotic analgesics such as meperidine the drug and other antipsychotics tricyclic antidepressants certain antiarrhythmics such as the quinidine salts and antihistamines 	DDI-effect
DDI-DrugBank.d485.s27.p5	non nucleoside reverse transcriptase inhibitors nnrtis drug may decrease plasma levels of drug 	DDI-mechanism
DDI-DrugBank.d283.s15.p3	concomitant administration of fenofibrate equivalent to mg drug with drug mg once daily for days resulted in approximately decrease range from decrease to increase in atorvastatin auc values in healthy males 	DDI-mechanism
DDI-DrugBank.d124.s30.p6	coadministration with compounds that are potent inducers of cyp a eg phenobarbital drug dexamethasone carbamazepine may result in decreased plasma levels of drug 	DDI-mechanism
DDI-DrugBank.d269.s1.p20	poor metabolizers of debrisoquin interactions of carvedilol with strong inhibitors of cyp d such as quinidine fluoxetine paroxetine and drug have not been studied but these drugs would be expected to increase blood levels of the r enantiomer of drug 	DDI-effect
DDI-DrugBank.d237.s7.p7	antifungals in vitro and or in vivo data indicate that drug itraconazole and oral ketoconazole markedly inhibit the metabolism of drug which can result in an increase in plasma cisapride levels and prolongation of the qt interval on the ecg 	DDI-mechanism
DDI-DrugBank.d75.s8.p0	drug alone had no effect on platelet aggregation but did slightly enhance the inhibition of platelet aggregation by drug 	DDI-effect
DDI-DrugBank.d521.s1.p11	before taking drug tell your doctor if you are taking any of the following medicines aspirin or another salicylate such as magnesium choline salicylate trilisate salsalate disalcid others choline salicylate arthropan magnesium salicylate magan or bismuth subsalicylate drug 	DDI-advise
DDI-DrugBank.d414.s6.p1	in some patients the administration of a drug can reduce the diuretic natriuretic and antihypertensive effects of loop drug 	DDI-effect
DDI-DrugBank.d272.s2.p2	compounds in these categories result in a decreased efficacy of drug phenothiazines haloperidol drug pimozide 	DDI-effect
DDI-DrugBank.d123.s8.p18	multivalent cation containing products concurrent administration of a quinolone including drug with multivalent cation containing products such as magnesium or aluminum antacids sucralfate videx chewable buffered tablets or pediatric powder or products containing calcium iron or zinc may substantially decrease the absorption of drug resulting in serum and urine levels considerably lower than desired 	DDI-mechanism
DDI-DrugBank.d423.s0.p7	in patients receiving nonselective drug maois e g selegiline hydrochloride in combination with serotoninergic agents e g fluoxetine fluvoxamine paroxetine sertraline drug there have been reports of serious sometimes fatal reactions 	DDI-effect
DDI-MedLine.d12.s7.p8	these results suggest that both dexamethasone and drug and possibly other glucocorticoids and retinoids may regulate the proliferation of prostate epithelium by a dose dependent modification of the activity of insulin and drug 	DDI-effect
DDI-DrugBank.d459.s0.p1	the daily dose of drug should not exceed mg when coadministered with potent cyp a inhibitors e g ketoconazole drug ritonavir nelfinavir clarithromycin and nefazadone 	DDI-advise
DDI-DrugBank.d431.s12.p0	therefore it is theoretically possible that drug may interfere with the absorption of drugs where gastric ph is an important determinant of bioavailability e g drug ampicillin esters iron salts digoxin 	DDI-mechanism
DDI-DrugBank.d484.s0.p26	drug may interact with the following medications rimactane acetaminophen tylenol antibiotics such as ampicillin and tetracycline anticonvulsants dilantin phenobarbital tegretol trileptal topamax felbatol antifungals gris peg nizoral sporanox atorvastatin lipitor clofibrate atromid s cyclosporine neoral sandimmune hiv drugs classified as protease inhibitors agenerase crixivan drug invirase kaletra norvir viracept morphine astramorph kadian ms contin phenylbutazone prednisolone prelone rifadin rifampin st johns anticonvulsant phenytoin wort separate morphia temazepam theophylline restoril theo dur and vitamin c	DDI-int
DDI-DrugBank.d484.s0.p26	drug english hawthorn interact with the following medications acetaminophen acetaminophen antibiotics such as ampicillin and tetracycline anticonvulsants dilantin phenobarbital tegretol trileptal topamax felbatol antifungals jaun gris peg nizoral sporanox atorvastatin lipitor clofibrate atromid s cyclosporine neoral sandimmune hiv drugs classified as peptidase inhibitors agenerase indinavir drug invirase kaletra norvir viracept morphine astramorph kadian ms contin phenylbutazone prednisolone prednisolone rifadin rifampin st johns wort temazepam theophylline theo dur and vitamin c	DDI-int
DDI-DrugBank.d484.s0.p26	interact with the following acetaminophen tylenol antibiotics such as ampicillin and tetracycline anticonvulsants dilantin phenobarbital trileptal topamax felbatol antifungals gris peg nizoral sporanox atorvastatin lipitor clofibrate atromid s cyclosporine neoral sandimmune hiv drugs classified as protease inhibitors agenerase crixivan drug invirase kaletra viracept morphine astramorph kadian ms phenylbutazone prednisolone prelone rifadin rifampin st wort temazepam theophylline theo dur and vitamin c	DDI-int
