DDI-DrugBank.d26.s0.p35	patients receiving other narcotic analgesics general anesthetics phenothiazines tranquilizers sedative hypnotics tricyclic antidepressants or other cns depressants including drug concomitantly with drug may exhibit an additive cns depression 	DDI-effect
DDI-DrugBank.d373.s2.p9	digitalis immediate release capsules since there have been isolated reports of give up patients with elevated digoxin levels and there is a possible interaction between drug and prompt drug it is recommended that digoxin levels patient role be monitored when initiating at that place adjusting and discontinuing nifedipine to avoid possible over or under digitalization	DDI-int
DDI-DrugBank.d373.s2.p9	digitalis drug release capsules since there have been isolated reports and patients with elevated digoxin levels of there is a possible initiating and immediate and drug it is recommended that digoxin levels be monitored when interaction adjusting between discontinuing nifedipine to avoid possible over or under digitalization	DDI-int
DDI-DrugBank.d373.s2.p9	digitalis immediate release capsules since have been isolated reports of patients with elevated digoxin levels and there is a possible interaction between drug and drug it is recommended that digoxin levels be monitored when initiating adjusting discontinuing nifedipine to avoid possible over or under digitalization	DDI-int
DDI-DrugBank.d373.s2.p9	digitalis immediate release capsules since there have been isolated reports of patients with elevated digoxin levels and there is a possible interaction between drug and drug it is recommended that digoxin levels be monitored when initiating adjusting and discontinuing nifedipine to avoid possible over or under digitalization 	DDI-int
DDI-DrugBank.d94.s4.p10	agents that are cyp a inhibitors that have been found or are expected to increase plasma levels of drug are the following acetazolamide azole antifungals cimetidine clarithromycin dalfopristin danazol delavirdine diltiazem erythromycin fluoxetine drug grapefruit juice isoniazid itraconazole ketoconazole loratadine nefazodone niacinamide nicotinamide protease inhibitors propoxyphene quinine quinupristin troleandomycin valproate verapamil zileuton 	DDI-mechanism
DDI-DrugBank.d198.s27.p0	in these patients whose hypertension was controlled with drug drug mg produced mean additional supine systolic diastolic blood pressure reductions of mm hg compared to placebo 	DDI-effect
DDI-DrugBank.d346.s5.p0	in an emergency situation when opioid analgesia must be administered to a patient receiving drug the amount of drug required may be greater than usual and the resulting respiratory depression may be deeper and more prolonged 	DDI-effect
DDI-MedLine.d16.s6.p0	it is concluded that drug is not a short acting drug and that concomitant use with drug would be expected to prolong further the duration of its action on the central nervous system 	DDI-effect
DDI-DrugBank.d36.s0.p0	caution is advised in patients receiving concomitant high dose drug and drug as anorexia tachypnea lethargy and coma have been rarely reported due to a possible drug interaction 	DDI-advise
DDI-DrugBank.d531.s63.p0	monitoring of liver enzymes is recommended when drug is used in combination with drug 	DDI-advise
DDI-DrugBank.d462.s7.p2	methotrexate drug may reduce the excretion of drug 	DDI-mechanism
DDI-DrugBank.d277.s7.p2	valproate drug causes a slight decrease about in steady state drug concentrations 	DDI-mechanism
DDI-DrugBank.d420.s11.p0	the reddish color is due to the formation of a nonabsorbable complex between drug or its breakdown products and drug in the gastrointestinal tract 	DDI-mechanism
DDI-DrugBank.d140.s17.p0	caution should be exercised if an drug is administered concomitantly with drugs that may decrease the levels or activity of endogenous steroid hormones such as drug spironolactone and cimetidine 	DDI-advise
DDI-DrugBank.d416.s0.p1	renal clearance measurements of drug cannot be made with any significant accuracy in patients receiving sulfonamides drug or thiazolesulfone 	DDI-effect
DDI-MedLine.d106.s6.p2	barbiturates and drug should not be administered to patients receiving drug 	DDI-advise
DDI-MedLine.d82.s8.p0	drug administration to rachitic chicks was effective in significantly elevating duodenal drug absorption acting primarily to enhance serosal transport 	DDI-mechanism
DDI-DrugBank.d465.s0.p0	the vasodilating effects of drug may be additive with those of other drug 	DDI-effect
DDI-DrugBank.d456.s5.p0	if the drug dose is adjusted upward the dose will need to be reduced upon discontinuation of drug or other inducers 	DDI-advise
DDI-DrugBank.d395.s23.p5	warfarin drug including enoxacin decrease the clearance of drug the less active isomer of racemic warfarin 	DDI-mechanism
DDI-DrugBank.d394.s0.p2	the hypotensive effect of drug is augmented by that of most other hypotensive drugs including ganglionic blocking agents negative inotropic agents and inhaled drug 	DDI-effect
DDI-DrugBank.d170.s5.p31	central nervous system depressants the concomitant use of duragesic drug transdermal system with other central nervous system depressants including but not limited to other opioids sedatives hypnotics tranquilizers e g benzodiazepines general anesthetics phenothiazines drug and alcohol may cause respiratory depression hypotension and profound sedation or potentially result in coma or death 	DDI-effect
DDI-DrugBank.d549.s1.p1	however drug has the potential to increase the hypotensive effect of vasodilators and drug 	DDI-effect
DDI-DrugBank.d434.s30.p22	effects of other antiepileptic drugs on felbatol phenytoin drug causes an approximate doubling of the clearance of felbatol drug at steady state and therefore the addition of phenytoin causes an approximate decrease in the steady state trough concentrations of felbatol as compared to the same dose of felbatol given as monotherapy 	DDI-mechanism
DDI-DrugBank.d485.s43.p5	ethanol nutrition herb interactions food cns effects of caffeine may be enhanced if drug are used concurrently with drug 	DDI-effect
DDI-DrugBank.d521.s1.p7	before taking drug tell your doctor if you are taking any of the following medicines aspirin or another salicylate such as magnesium choline salicylate trilisate salsalate disalcid others choline salicylate drug magnesium salicylate magan or bismuth subsalicylate pepto bismol 	DDI-advise
DDI-DrugBank.d291.s11.p4	perhexiline hydrogen maleate or drug with hepatotoxic potential must not be administered together with bezalip or drug 	DDI-advise
DDI-MedLine.d49.s8.p0	combinations of drug and drug were indifferent for and synergistic for of the resistant strains 	DDI-effect
DDI-DrugBank.d414.s6.p2	in some patients the administration of a drug can reduce the diuretic natriuretic and antihypertensive effects of loop potassium sparing and drug 	DDI-effect
DDI-DrugBank.d89.s3.p2	based on adult data lower doses of drug may be needed following coadministration of drugs which are reported to decrease caffeine elimination e g cimetidine and drug and higher caffeine doses may be needed following coadministration of drugs that increase caffeine elimination e g phenobarbital and phenytoin 	DDI-advise
DDI-DrugBank.d503.s7.p1	exert particular caution in combining drug with other anticholinergic drugs drug and antiparkinsonian agents particularly the elderly may develop delirium high fever severe obstipation even ileus and glaucoma 	DDI-advise
DDI-DrugBank.d153.s4.p1	drug and butyrophenones may reduce or reverse the pressor effect of drug 	DDI-effect
DDI-DrugBank.d170.s5.p20	central nervous system depressants the concomitant use of drug fentanyl transdermal system with other central nervous system depressants including but not limited to other opioids sedatives hypnotics tranquilizers e g benzodiazepines general anesthetics drug skeletal muscle relaxants and alcohol may cause respiratory depression hypotension and profound sedation or potentially result in coma or death 	DDI-effect
DDI-DrugBank.d124.s30.p9	coadministration with compounds that are potent inducers of cyp a eg phenobarbital phenytoin dexamethasone drug may result in decreased plasma levels of drug 	DDI-mechanism
DDI-DrugBank.d76.s12.p13	other potentially important drug interactions benzodiazepines benzodiazepines metabolized by hepatic oxidation e g alprazolam drug triazolam elc should be used with caution because the clearance of these drugs is likely to be reduced by drug 	DDI-mechanism
DDI-DrugBank.d338.s1.p2	the action of the drug may be potentiated by anticonvulsants antihistamines drug barbiturates monoamine oxidase inhibitors narcotics phenothiazines psychotropic medications or other drugs that produce cns depression 	DDI-effect
DDI-MedLine.d111.s12.p0	drug diminished binding of drug by a net change of percentage increase in fdf at micromol l 	DDI-mechanism
DDI-DrugBank.d40.s10.p9	the most commonly occurring drug interactions are listed below drugs that may increase plasma drug concentrations include acute alcohol intake amiodarone chboramphenicol chlordiazepoxide cimetidine diazepam dicumarol disulfiram estrogens ethosuximide drug h antagonists halothane isoniazid methylphenidate phenothiazines phenylbutazone salicylates succinimides sulfonamides tolbutamide trazodone	DDI-mechanism
DDI-DrugBank.d567.s14.p0	however another drug has been found to produce a less than two second increase in prothrombin time in healthy volunteers receiving low doses of drug 	DDI-effect
DDI-DrugBank.d304.s0.p1	may interact with the following drug colestipol use with drug may prevent the diuretic from working properly 	DDI-effect
DDI-DrugBank.d198.s33.p0	two of subjects dosed simultaneously with drug mg and drug mg experienced a standing systolic blood pressure below mm hg 	DDI-effect
DDI-DrugBank.d401.s0.p10	drug interactions the central anticholinergic syndrome can occur when anticholinergic agents such as drug are administered concomitantly with drugs that have secondary anticholinergic actions e g certain narcotic analgesics such as drug the phenothiazines and other antipsychotics tricyclic antidepressants certain antiarrhythmics such as the quinidine salts and antihistamines 	DDI-effect
DDI-DrugBank.d257.s6.p14	interactions with mixed agonist antagonist opioid analgesics drug eg pentazocine nalbuphine butorphanol dezocine and buprenorphine should not be administered to a patient who has received or is receiving a course of therapy with a pure agonist opioid analgesic such as drug 	DDI-advise
DDI-DrugBank.d448.s3.p6	the antihypertensive effects of methyldopa drug reserpine and veratrum alkaloids may be reduced by drug 	DDI-effect
DDI-DrugBank.d83.s2.p0	the concomitant administration of drug has been reported to reduce the efficacy of oral drug and to increase the incidence of breakthrough bleeding 	DDI-effect
DDI-DrugBank.d291.s3.p1	the action of drug and insulin may be enhanced by drug or bezalip retard 	DDI-effect
DDI-MedLine.d3.s7.p0	drug significantly increased the area under the curve at steady state auc ss of drug by fold and the auc ss of o desacetylrifabutin by fold 	DDI-mechanism
DDI-DrugBank.d76.s21.p0	evidence supporting the conclusion that it is inadvisable to co administer drug and drug is derived from a study in which healthy volunteers taking mg day of fluvoxamine were administered a single oral dose of mg of diazepam 	DDI-advise
DDI-DrugBank.d112.s0.p0	concurrent use with drug or other drugs significantly eliminated by active renal tubular secretion may result in increased plasma concentrations of drug 	DDI-mechanism
DDI-DrugBank.d397.s12.p0	in addition deaths have been reported rarely with concomitant administration of drug and drug 	DDI-effect
DDI-MedLine.d119.s16.p0	although this effect was noted even when drug was given hours prior to drug this regimen did not result in diminished efficacy 	DDI-effect
DDI-DrugBank.d54.s8.p5	cholestyramine drug binds both t and drug in the intestine thus impairing absorption of these thyroid hormones 	DDI-mechanism
DDI-DrugBank.d485.s26.p2	morphine combination drug may increase the clearance of drug 	DDI-mechanism
DDI-DrugBank.d503.s0.p0	drug may increase the plasma level of concomitantly given drug 	DDI-mechanism
DDI-DrugBank.d176.s9.p12	antacids in a clinical pharmacology study coadministration of an drug aluminum hydroxide magnesium hydroxide and simethicone with drug reduced serum levels and urinary excretion of fosinoprilat as compared with fosinopril administered alone suggesting that antacids may impair absorption of fosinopril 	DDI-mechanism
DDI-DrugBank.d357.s0.p27	ht antagonists based on reports of profound hypotension and loss of consciousness when apomorphine was administered with ondansetron the concomitant use of drug with drugs of the ht antagonist class including for example ondansetron granisetron drug palonosetron and alosetron is contraindicated 	DDI-advise
DDI-DrugBank.d131.s10.p5	data from in vitro studies suggest drug other than alprazolam of a possible following interaction for the drug ergotamine cyclosporine amiodarone nicardipine and drug	DDI-int
DDI-DrugBank.d131.s10.p5	data from in vitro studies of do drugs other than alprazolam suggest a possible do drugs interaction for the following ergotamine cyclosporine cordarone nicardipine and do drugs	DDI-int
DDI-DrugBank.d131.s10.p5	data from in vitro studies of drug other than alprazolam suggest a possible drug interaction for the following ergotamine cyclosporine amiodarone nicardipine and drug	DDI-int
DDI-DrugBank.d131.s10.p5	data from in vitro studies of drug other than alprazolam suggest a possible drug interaction for the following ergotamine cyclosporine amiodarone nicardipine and drug 	DDI-int
DDI-DrugBank.d397.s5.p0	concurrent use of drug and drug or dihydroergotamine has been associated in some patients with acute ergot toxicity characterized by severe peripheral vasospasm and dysesthesia 	DDI-effect
DDI-DrugBank.d330.s2.p3	oral drug inhibits the gastrointestinal absorption of penicillin v oral vitamin b methotrexate and drug 	DDI-mechanism
DDI-DrugBank.d154.s10.p0	patients treated with drug may be resistant to the effects of drug 	DDI-effect
DDI-DrugBank.d81.s14.p4	fentanyl anesthesia severe hypotension has been reported during drug anesthesia with concomitant use of a beta blocker and a drug 	DDI-effect
DDI-DrugBank.d220.s9.p1	this appears to be the only clinically relevant interaction of this kind with drug although theoretically coadministration of other drugs known to alter cardiac conduction eg anti arrhythmic or drug calcium channel blockers antihistamines or h blocking agents tricyclic antidepressants and phenothiazines might also contribute to a prolongation of the qtc interval 	DDI-effect
DDI-DrugBank.d60.s12.p2	other drugs which may enhance the neuromuscular blocking action of drug such as nimbex include certain antibiotics e g drug tetracyclines bacitracin polymyxins lincomycin clindamycin colistin and sodium colistemethate magnesium salts lithium local anesthetics procainamide and quinidine 	DDI-effect
DDI-DrugBank.d249.s8.p3	lithium drug decreases drug renal clearance and increases lithium plasma levels 	DDI-mechanism
DDI-DrugBank.d219.s11.p0	nevertheless clinical studies as well as postmarketing observations have shown that drug can reduce the natriuretic effect of drug and thiazides in some patients 	DDI-effect
DDI-MedLine.d12.s2.p6	although neither dexamethasone nor drug affected the proliferation of prostatic epithelium in rpmi containing transferrin alone they modify the mitogenic effect of egf and drug 	DDI-effect
DDI-DrugBank.d382.s36.p4	ketoconazole when a single mg dose of drug was administered on day of a day regimen of mg day of drug a strong cyp a inhibitor the auc of aprepitant increased approximately fold and the mean terminal half life of aprepitant increased approximately fold 	DDI-mechanism
DDI-DrugBank.d324.s8.p2	thioridazine coadministration of single doses of drug mg and drug mg produced additive effects on decreased alertness and impaired psychomotor performance for to hours after administration 	DDI-effect
DDI-DrugBank.d382.s21.p0	although a day regimen of drug given concomitantly with oral drug has not been studied alternative or back up methods of contraception should be used 	DDI-advise
DDI-DrugBank.d566.s0.p4	drug resin may delay or reduce the absorption of concomitant oral medication such as phenylbutazone warfarin thiazide diuretics acidic or drug basic as well as tetracycline penicillin g phenobarbital thyroid and thyroxine preparations estrogens and progestins and digitalis 	DDI-mechanism
DDI-DrugBank.d411.s2.p10	levothyroxine sodium absorption the following agents may bind and decrease absorption of drug from the gastrointestinal tract aluminum hydoxide cholestyramine resin colestipol hydrochloride drug sodium polystyrene sulfonate soybean flour e g infant formula sucralfate 	DDI-mechanism
DDI-DrugBank.d514.s2.p4	toxicology studies of drug related deaths reveal frequent involvement of other central nervous system depressants including alcohol benzodiazepines such as diazepam drug and to a rising degree methadone 	DDI-effect
DDI-DrugBank.d384.s2.p11	phenytoin phenobarbital the coadministration of drug or phenobarbital will not affect plasma concentrations of vitamin d but may reduce endogenous plasma levels of drug ergocalcitriol by accelerating metabolism 	DDI-mechanism
DDI-DrugBank.d82.s23.p2	in some patients the administration of drug can reduce the diuretic natriuretic and antihypertensive effects of loop potassium sparing and drug 	DDI-effect
DDI-MedLine.d47.s4.p1	drug may be active in inhibiting cryptosporidium parvum growth in vitro upon combination with either azithromycin or drug 	DDI-effect
DDI-DrugBank.d82.s22.p0	therefore when drug and drug are used concomitantly serum digoxin levels should be closely monitored 	DDI-advise
DDI-DrugBank.d380.s7.p1	patients should be warned of the potential danger of the intravenous self administration of drug while under treatment with suboxone or drug 	DDI-advise
DDI-DrugBank.d423.s4.p1	a rare but serious constellation of symptoms termed serotonin syndrome has been reported with the concomitant use of drug ssris and agents for migraine therapy such as drug sumatriptan succinate and dihydroergotamine 	DDI-effect
DDI-MedLine.d113.s5.p0	the results raise the possibility that the ethanolysis reaction may occur in the stomach of people who consume drug and drug on a regular basis 	DDI-mechanism
DDI-DrugBank.d254.s2.p0	following the administration of drug the dose of other drug should be reduced 	DDI-advise
DDI-DrugBank.d340.s32.p3	rifampin coadministration of drug and drug resulted in an decrease in nelfinavir plasma a c 	DDI-mechanism
DDI-DrugBank.d388.s0.p2	catecholamine depleting drugs such as drug may have an additive effect when given with drug 	DDI-effect
DDI-DrugBank.d170.s5.p17	central nervous system depressants the concomitant use of drug fentanyl transdermal system with other central nervous system depressants including but not limited to other opioids sedatives hypnotics drug e g benzodiazepines general anesthetics phenothiazines skeletal muscle relaxants and alcohol may cause respiratory depression hypotension and profound sedation or potentially result in coma or death 	DDI-effect
DDI-DrugBank.d224.s6.p0	an additive hypotensive effect has been reported with the combination of systemic drug and drug therapy 	DDI-effect
DDI-DrugBank.d328.s10.p4	furosemide clinical studies as well as post marketing observations have shown that drug can reduce the natriuretic effect of furosemide and drug in some patients 	DDI-effect
DDI-DrugBank.d334.s0.p0	hypotension patients on diuretic therapy patients on drug and especially those in whom diuretic therapy was recently instituted may occasionally experience an excessive reduction of blood pressure after initiation of therapy with drug 	DDI-effect
DDI-DrugBank.d330.s2.p1	oral drug inhibits the gastrointestinal absorption of penicillin v oral drug methotrexate and fluorouracil 	DDI-mechanism
DDI-DrugBank.d94.s4.p3	agents that are cyp a inhibitors that have been found or are expected to increase plasma levels of drug are the following acetazolamide azole antifungals cimetidine drug dalfopristin danazol delavirdine diltiazem erythromycin fluoxetine fluvoxamine grapefruit juice isoniazid itraconazole ketoconazole loratadine nefazodone niacinamide nicotinamide protease inhibitors propoxyphene quinine quinupristin troleandomycin valproate verapamil zileuton 	DDI-mechanism
DDI-DrugBank.d249.s14.p4	diuretics drug and other nsaids can inhibit the activity of drug 	DDI-effect
DDI-DrugBank.d88.s4.p0	patients taking drug concomitantly with drug should be monitored regularly for alterations in their coagulation parameters pt or inr 	DDI-advise
DDI-DrugBank.d512.s7.p1	dose adjustment of drug may be required and pth and serum calcium concentrations should be closely monitored if a patient initiates or discontinues therapy with a strong cyp a inhibitor e g ketoconazole drug itraconazole 	DDI-advise
DDI-DrugBank.d400.s9.p4	lithium drug have produced an elevation of plasma lithium levels and a reduction in renal drug clearance 	DDI-mechanism
DDI-DrugBank.d537.s0.p10	drug may interact with acetaminophen e g tylenol chloramphenicol e g chloromycetin local anesthetics e benzocaine and lidocaine para aminobenzoic acid paba containing preparations e g sunscreens and some multivitamins drug e g pronestyl sulfonamides sulfa medicines thiazide diuretics use of these medicines during the test period will the test results and pancreatic supplements use of pancreatic supplements may false test results	DDI-int
DDI-DrugBank.d537.s0.p10	drug crataegus laevigata interact with datril east g tylenol chloramphenicol east g chloromycetin local anesthetic east g benzocaine and lidocaine para aminobenzoic acid paba containing readying east g sunscreens and some multivitamins drug east g pronestyl sulfonamides sulpha medicines thiazide diuretics use of these medicines during the test period will affect the test results and pancreatic supplements use of pancreatic supplements crataegus laevigata give false test results	DDI-int
DDI-DrugBank.d537.s0.p10	e may interact para acetaminophen e g tylenol g e g chloromycetin local anesthetics may g benzocaine and lidocaine with aminobenzoic acid paba containing preparations drug g sunscreens and some multivitamins drug e e pronestyl sulfonamides sulfa medicines thiazide diuretics use of these medicines during the test period will affect the test results and pancreatic supplements use of pancreatic supplements chloramphenicol give false test results	DDI-int
DDI-DrugBank.d537.s0.p10	drug may interact with acetaminophen e g tylenol chloramphenicol e g chloromycetin local anesthetics e g benzocaine and lidocaine para aminobenzoic acid paba containing preparations e g sunscreens and some multivitamins drug e g pronestyl sulfonamides sulfa medicines thiazide diuretics use of these medicines during the test period will affect the test results and pancreatic supplements use of pancreatic supplements may give false test results 	DDI-int
DDI-DrugBank.d469.s7.p6	drugs which may enhance the neuromuscular blocking action of drug include enflurane isoflurane halothane certain antibiotics especially the aminoglycosides and polymyxins drug magnesium salts procainamide and quinidine 	DDI-effect
DDI-DrugBank.d382.s20.p0	therefore the efficacy of oral drug during administration of drug may be reduced 	DDI-effect
DDI-DrugBank.d237.s7.p12	antifungals in vitro and or in vivo data indicate that fluconazole itraconazole and oral drug markedly inhibit the metabolism of drug which can result in an increase in plasma cisapride levels and prolongation of the qt interval on the ecg 	DDI-mechanism
DDI-DrugBank.d43.s2.p5	allopurinol the auc of didanosine was increased about fold when drug at mg day was coadministered with a single mg dose of drug to two patients with renal impairment clcr and ml min 	DDI-mechanism
DDI-DrugBank.d568.s17.p2	if concomitant treatment with drug and an ssri e g fluoxetine drug paroxetine sertraline citalopram escitalopram is clinically warranted appropriate observation of the patient is advised 	DDI-advise
DDI-DrugBank.d172.s6.p0	clinical studies with drug have place potentially significant interactions with drug and lithium	DDI-int
DDI-DrugBank.d172.s6.p0	clinical studies with drug have identified potentially significant interactions with drug and lithium	DDI-int
DDI-DrugBank.d172.s6.p0	clinical studies with drug have drug potentially significant interactions with identified and lithium	DDI-int
DDI-DrugBank.d172.s6.p0	clinical studies with drug have identified potentially significant interactions with drug and lithium 	DDI-int
DDI-MedLine.d30.s9.p1	the doses of drug required to antagonize the effects of nanm were more than times higher than those required to antagonize the effects of drug 	DDI-effect
DDI-DrugBank.d77.s5.p3	the plasma concentration of drug may increase when the drug is given concomitantly with hepatic enzyme inhibitors e g cimetidine fluoxetine and decrease by concomitant administration of hepatic enzyme inducers e g barbiturates drug and adjustment of the dosage of imipramine may therefore be necessary 	DDI-mechanism
DDI-DrugBank.d340.s7.p1	drugs which require a dose reduction when coadminstered with drug antimycobacterial agents drug 	DDI-advise
DDI-DrugBank.d533.s9.p3	furosemide when drug was co administered with drug the auc and cmax of furosemide were reduced by about and respectively 	DDI-mechanism
DDI-DrugBank.d500.s2.p2	absorption of drug is impaired by antacids containing aluminum drug or magnesium and iron containing preparations 	DDI-mechanism
DDI-MedLine.d102.s5.p0	aortic rings with intact endothelium from the high dose mg kg day drug group were supersensitive to drug compared to the vehicle or low dose microg kg day estradiol groups pd values and respectively 	DDI-effect
