DDI-MedLine.d49.s6.p0	combinations of drug and drug were indifferent for strains and synergistic for strains 	DDI-effect
DDI-DrugBank.d328.s4.p3	aspirin concomitant administration of drug with drug may result in an increased risk of gi ulceration and complications compared to valdecoxib alone 	DDI-effect
DDI-DrugBank.d142.s0.p0	additive adverse effects resulting from cholinergic blockade may occur when drug is administered concomitantly with other drug amantadine haloperidol phenothiazines monoamine oxidase mao inhibitors tricyclic antidepressants or some antihistamines 	DDI-effect
DDI-DrugBank.d509.s20.p0	when drug is added to drug therapy aripiprazole dose should be doubled 	DDI-advise
DDI-DrugBank.d434.s17.p3	carbamazepine drug causes a decrease in the steady state drug plasma concentrations and an increase in the steady state carbamazepine epoxide plasma concentration 	DDI-mechanism
DDI-DrugBank.d405.s1.p2	other depressasnts such as drug barbiturates and maois may enhance cns depression when administered with drug 	DDI-effect
DDI-DrugBank.d340.s14.p4	indinavir coadministration of drug with drug resulted in an increase in nelfinavir plasma auc and a increase in indinavir plasma a c 	DDI-mechanism
DDI-DrugBank.d260.s3.p3	nephrotoxic agents concomitant administration of drug and agents with nephrotoxic potential e g intravenous aminoglycosides e g tobramycin gentamicin and drug amphotericin b foscarnet intravenous pentamidine vancomycin and non steroidal anti inflammatory agents is contraindicated 	DDI-advise
DDI-DrugBank.d400.s5.p0	this interaction should be given consideration in patients taking drug concomitantly with drug 	DDI-advise
DDI-DrugBank.d552.s1.p0	drug has been shown to have an additive cns depressant effect when given with either drug secobarbitone sodium alcohol or codeine 	DDI-effect
DDI-DrugBank.d400.s0.p5	aspirin as with other nsaids concomitant administration of drug and drug is not generally recommended because of the potential of increased adverse effects 	DDI-advise
DDI-DrugBank.d314.s19.p5	drugs which inhibit cyp a e g ketoconazole macrolide antibiotics such as drug have the potential to result in increased plasma concentrations of drug 	DDI-mechanism
DDI-DrugBank.d227.s0.p1	drug potentiates the muscle relaxant effect of all muscle relaxants most notably drug and mac minimum alveolar concentration is reduced by concomitant administration of n o 	DDI-effect
DDI-DrugBank.d401.s0.p13	drug interactions the central anticholinergic syndrome can occur when anticholinergic agents such as drug are administered concomitantly with drugs that have secondary anticholinergic actions e g certain narcotic analgesics such as meperidine the phenothiazines and other antipsychotics drug certain antiarrhythmics such as the quinidine salts and antihistamines 	DDI-effect
DDI-DrugBank.d10.s2.p0	drug administration to three cancer patients over a dose range of mg to mg led to a dose dependent inhibition of drug elimination the effect of alternate day administration of mg of betaseron on drug metabolism in ms patients is unknown 	DDI-mechanism
DDI-DrugBank.d85.s9.p3	naproxen and other drug can reduce the antihypertensive effect of drug and other beta blockers 	DDI-effect
DDI-DrugBank.d11.s3.p1	dosage adjustment of drug may be necessary when coadministered with cyp d inhibitors e g paroxetine drug and quinidine 	DDI-advise
DDI-DrugBank.d499.s20.p0	therefore the combination of drug and drug is not recommended 	DDI-advise
DDI-DrugBank.d19.s9.p5	in rats simultaneous ingestion of disulfiram and nitrite in the diet for weeks has been reported to cause tumors and it has been suggested that drug may react with drug in the rat stomach to form a nitrosamine which is tumorigenic 	DDI-effect
DDI-DrugBank.d179.s38.p7	methotrexate e g mexate use of drug with drug may increase the chance of side effects affecting the liver and or the side effects of methotrexate	DDI-effect
DDI-DrugBank.d353.s11.p2	tetracyclines since both drug and drug can cause increased intracranial pressure their combined use is contraindicated 	DDI-effect
DDI-DrugBank.d329.s3.p0	because of the small effect on half life the coadministration with drug to extend the half life of drug is not recommended 	DDI-advise
DDI-DrugBank.d478.s1.p6	because there is a theoretical basis that these effects may be additive use of ergotamine containing or drug like dihydroergotamine or methysergide and drug within hours is contraindicated 	DDI-advise
DDI-DrugBank.d115.s9.p0	particular caution is recommended when administering drug with cyp a substrates that have a narrow therapeutic window e g drug or pimozide 	DDI-advise
DDI-DrugBank.d53.s7.p6	when used in therapeutic doses drug had a modest effect on the pharmacokinetics of atorvastatin carbamazepine cetirizine didanosine efavirenz fluconazole drug midazolam rifabutin sildenafil theophylline intravenous and oral triazolam trimethoprim sulfamethoxazole or zidovudine 	DDI-mechanism
DDI-DrugBank.d484.s0.p24	drug may interact with the following medications acetaminophen tylenol antibiotics such as ampicillin and dose tetracycline anticonvulsants dilantin phenobarbital tegretol trileptal topamax felbatol antifungals gris peg morphine nizoral sporanox atorvastatin lipitor clofibrate atromid s cyclosporine neoral sandimmune hiv drugs classified as protease inhibitors drug crixivan fortovase invirase acetaminophen kaletra norvir viracept morphine astramorph kadian ms contin phenylbutazone prednisolone prelone rifadin rifampin st acetaminophen johns wort temazepam theophylline theo jaun gris morphia dur and vitamin c	DDI-int
DDI-DrugBank.d484.s0.p24	drug may interact with the following medications classified tegretol antibiotics such protease ampicillin and tetracycline anticonvulsants dilantin phenobarbital tylenol trileptal topamax felbatol antifungals gris peg nizoral sporanox prelone lipitor clofibrate atromid s cyclosporine neoral norvir hiv drugs rifadin as as inhibitors drug crixivan fortovase invirase kaletra sandimmune viracept morphine astramorph kadian ms contin phenylbutazone prednisolone atorvastatin acetaminophen rifampin st johns wort temazepam theophylline theo dur and vitamin c	DDI-int
DDI-DrugBank.d484.s0.p24	dose may interact with the stick to medications acetaminophen tylenol antibiotics such as ampicillin and tetracycline anticonvulsants dilantin phenobarbital tegretol trileptal topamax felbatol antifungals gris peg nizoral itraconazole atorvastatin lipitor clofibrate atromid s cyclosporine neoral sandimmune hiv drugs classified as protease inhibitors dose indinavir fortovase invirase kaletra norvir viracept morphia astramorph kadian ms contin phenylbutazone prednisolone prelone rifadin rimactane st johns wort temazepam theophylline theo dur and vitamin c	DDI-int
DDI-DrugBank.d484.s0.p24	drug may interact with the following medications acetaminophen tylenol antibiotics such as ampicillin and tetracycline anticonvulsants dilantin phenobarbital tegretol trileptal topamax felbatol antifungals gris peg nizoral sporanox atorvastatin lipitor clofibrate atromid s cyclosporine neoral sandimmune hiv drugs classified as protease inhibitors drug crixivan fortovase invirase kaletra norvir viracept morphine astramorph kadian ms contin phenylbutazone prednisolone prelone rifadin rifampin st johns wort temazepam theophylline theo dur and vitamin c 	DDI-int
DDI-DrugBank.d77.s2.p8	avoid the use of preparations such as decongestants and local drug which contain any sympathomimetic amine e g epinephrine norepinephrine since it has been reported that drug can potentiate the effects of catecholamines 	DDI-advise
DDI-DrugBank.d296.s0.p4	drug has additive effects with alcohol and other cns depressants hypnotics sedatives drug etc 	DDI-effect
DDI-DrugBank.d568.s39.p8	concomitant administration with racemic citalopram citalopram since drug is the active isomer of racemic citalopram drug the two agents should not be coadministered 	DDI-advise
DDI-DrugBank.d267.s5.p7	other drugs which may enhance the neuromuscular blocking action of nondepolarizing agents such as drug include certain antibiotics e g aminoglycosides tetracyclines bacitracin polymyxins lincomycin clindamycin drug and sodium colistimethate magnesium salts lithium local anesthetics procainamide and quinidine 	DDI-effect
DDI-DrugBank.d207.s7.p4	drugs that cause significant sustained elevation in gastric ph histamine h receptor antagonists such as drug or cimetidine may reduce plasma concentrations of drug and therefore potentially may reduce efficacy 	DDI-mechanism
DDI-DrugBank.d398.s0.p2	the use of drug may result in additive cns depressant effects when coadministered with alcohol antihistamines drug or other drugs that produce cns depression 	DDI-effect
DDI-DrugBank.d241.s0.p0	additional reductions in blood pressure may occur when drug is administered with drug antihypertensive agents or other vasodilators 	DDI-effect
DDI-DrugBank.d340.s6.p11	drugs that should not be coadministered with drug antiarrhythmics amiodarone quinidine antihistamines astemizole terfenadine antimigraine ergot derivatives antimycobacterial agents rifampin benzodiazepines midazolam drug gi motility agents cisapride	DDI-advise
DDI-DrugBank.d314.s18.p7	hepatic enzyme inducers inhibitors and substrates drugs which induce cytochrome p a cyp a enzyme activity e g barbiturates drug carbamazepine rifampin may enhance the metabolism of drug and require that the dosage of the corticosteroid be increased 	DDI-mechanism
DDI-DrugBank.d5.s22.p3	drugs that lower seizure threshold concurrent administration of drug and agents e g antipsychotics other antidepressants theophylline systemic drug etc that lower seizure threshold should be undertaken only with extreme caution 	DDI-advise
DDI-DrugBank.d228.s1.p0	similarly drug decreased the rate of elimination of drug by approximately by the same mechanism 	DDI-mechanism
DDI-DrugBank.d165.s15.p0	coadministration of drug and drug tacrolimus or digoxin has led to increased plasma concentrations of the latter three drugs 	DDI-mechanism
DDI-DrugBank.d165.s3.p0	coadministration of drug with drug has led to elevated plasma concentrations of terfenadine resulting in rare instances of life threatening cardiac dysrhythmias and one death 	DDI-mechanism
DDI-MedLine.d3.s7.p1	drug significantly increased the area under the curve at steady state auc ss of rifabutin by fold and the auc ss of drug by fold 	DDI-mechanism
DDI-DrugBank.d450.s12.p2	although beta adrenergic blockers or drug and drug may be useful in combination to control atrial fibrillation their additive effects on av node conduction can result in advanced or complete heart block 	DDI-effect
DDI-DrugBank.d171.s0.p8	drug apparently through an effect on certain microsomal enzyme systems has been reported to reduce the hepatic metabolism of warfarin type anticoagulants phenytoin propranolol nifedipine chlordiazepoxide diazepam certain tricyclic antidepressants lidocaine drug and metronidazole thereby delaying elimination and increasing blood levels of these drugs 	DDI-mechanism
DDI-DrugBank.d123.s8.p2	multivalent cation containing products concurrent administration of a drug including ciprofloxacin with multivalent cation containing products such as magnesium or drug antacids sucralfate videx chewable buffered tablets or pediatric powder or products containing calcium iron or zinc may substantially decrease the absorption of ciprofloxacin resulting in serum and urine levels considerably lower than desired 	DDI-mechanism
DDI-DrugBank.d131.s6.p0	coadministration of drug decreased the maximum plasma concentration of drug by decreased clearance by and increased half life by 	DDI-mechanism
DDI-DrugBank.d488.s1.p0	therefore when drug is given with drug or warfarin sodium a period of at least hours after the last intravenous dose or hours after the last subcutaneous dose should elapse before blood is drawn if a valid prothrombin time is to be obtained 	DDI-advise
DDI-DrugBank.d350.s12.p13	in addition results from regression analyses of patient pharmacokinetic data suggest that co administration of other inducers of drug clearance efavirenz nevirapine drug dexamethasone or carbamazepine with drug may result in clinically meaningful reductions in caspofungin concentrations 	DDI-mechanism
DDI-DrugBank.d267.s5.p2	other drugs which may enhance the neuromuscular blocking action of nondepolarizing agents such as drug include certain antibiotics e g aminoglycosides drug bacitracin polymyxins lincomycin clindamycin colistin and sodium colistimethate magnesium salts lithium local anesthetics procainamide and quinidine 	DDI-effect
DDI-DrugBank.d4.s0.p2	synergism between drug e g theophylline ephedrine and other drug has been reported 	DDI-effect
DDI-DrugBank.d368.s10.p0	drug reduces urinary excretion of drug and may enhance its effect 	DDI-mechanism
DDI-DrugBank.d257.s6.p20	interactions with mixed agonist antagonist opioid analgesics agonist antagonist analgesics eg drug nalbuphine butorphanol dezocine and buprenorphine should not be administered to a patient who has received or is receiving a course of therapy with a pure agonist opioid analgesic such as drug 	DDI-advise
DDI-DrugBank.d238.s6.p17	plasma levels of several closely related tricyclic antidepressants have been reported to be increased by the concomitant administration of methylphenidate or hepatic enzyme inhibitors e g cimetidine drug and decreased by the concomitant administration of hepatic enzyme inducers e g barbiturates phenytoin and such an effect may be anticipated with drug as well 	DDI-mechanism
DDI-DrugBank.d13.s0.p0	drug interactions drug may interact with some drugs like drug antidepressant drug antidepressant maoi dose maoi could theoretically affect flupenthixol pharmacodynamics arecoline eproxindine ethanol flupenthixol and ethanol cause additive cns depression tricyclic antidepressants flupenthixol increases the effect of tricyclic antidepressants	DDI-int
DDI-DrugBank.d13.s0.p0	drug interactions drug may interact with some drugs like drug maoi maoi could theoretically affect flupenthixol pharmacodynamics arecoline eproxindine ethanol flupenthixol and ethanol cause additive cns depression tricyclic antidepressant drug antidepressant drug flupenthixol increment the effect of tricyclic antidepressant drug antidepressant drug	DDI-int
DDI-DrugBank.d13.s0.p0	drug interactions drug may interact with some drugs drug maoi maoi could theoretically pharmacodynamics arecoline eproxindine ethanol flupenthixol and ethanol cause additive cns antidepressants flupenthixol increases the effect of tricyclic antidepressants	DDI-int
DDI-DrugBank.d13.s0.p0	drug interactions drug may interact with some drugs like drug maoi maoi could theoretically affect flupenthixol pharmacodynamics arecoline eproxindine ethanol flupenthixol and ethanol cause additive cns depression tricyclic antidepressants flupenthixol increases the effect of tricyclic antidepressants	DDI-int
DDI-DrugBank.d107.s9.p0	this interaction should be given consideration in patients taking drug concomitantly with drug 	DDI-advise
DDI-DrugBank.d537.s0.p2	g give interact e acetaminophen with g tylenol drug e drug chloromycetin local anesthetics e supplements benzocaine and lidocaine para aminobenzoic acid paba containing preparations e g sunscreens and some multivitamins procainamide e g pronestyl sulfonamides sulfa medicines thiazide diuretics use of these medicines test the during affect will period the test results and pancreatic supplements use of pancreatic g may may false test results	DDI-int
DDI-DrugBank.d537.s0.p2	drug may interact with acetaminophen mental testing e sulpha g tylenol drug e g chloromycetin local anesthetics e g benzocaine and santa maria de belem lidocaine para aminobenzoic acid paba containing preparations e g sunscreens and some multivitamins procainamide e g pronestyl sulfonamides sulfa medicines thiazide diuretics mental testing use of whitethorn these medicines during the test period will affect the test results and pancreatic supplements use of pancreatic supplements may give false test results	DDI-int
DDI-DrugBank.d537.s0.p2	dose may interact with tylenol e g tylenol dose e g chloromycetin local anesthetics e g benzocaine and lidocaine para aminobenzoic acid para aminobenzoic acid containing homework e g sun blocker and some multivitamins procainamide e g pronestyl sulfonamides sulfa medicines thiazide diuretic use of these medicines during the test period will affect the test results and pancreatic supplements use of pancreatic supplements may give false test results	DDI-int
DDI-DrugBank.d537.s0.p2	drug may interact with acetaminophen e g tylenol drug e g chloromycetin local anesthetics e g benzocaine and lidocaine para aminobenzoic acid paba containing preparations e g sunscreens and some multivitamins procainamide e g pronestyl sulfonamides sulfa medicines thiazide diuretics use of these medicines during the test period will affect the test results and pancreatic supplements use of pancreatic supplements may give false test results 	DDI-int
DDI-DrugBank.d86.s0.p3	the concurrent use of two or more drugs with anticholinergic activity such as an drug eg chlorpromazine an antiparkinsonian drug eg trihexyphenidyl and or a drug eg amitriptyline commonly results in excessive anticholinergic effects including dry mouth and associated dental complications blurred vision and in patients exposed to high temperature and humidity hyperpyrexia 	DDI-effect
DDI-DrugBank.d516.s5.p7	magnesium and aluminum containing drug administered concomitantly with drug significantly decreased the bioavailability of lomefloxacin 	DDI-mechanism
DDI-DrugBank.d334.s19.p2	lithium toxicity was usually reversible upon discontinuation of drug and the drug 	DDI-effect
DDI-DrugBank.d163.s0.p4	vitamin a because of the relationship of drug to drug patients should be advised against taking vitamin supplements containing vitamin a to avoid additive toxic effects	DDI-effect
DDI-DrugBank.d382.s23.p3	the potential effects of increased plasma concentrations of drug or other benzodiazepines metabolized via cyp a alprazolam triazolam should be considered when coadministering these agents with drug 	DDI-advise
DDI-DrugBank.d60.s6.p8	isoflurane or drug administered with nitrous oxide oxygen to achieve mac minimum alveolar concentration may prolong the clinically effective duration of action of initial and maintenance doses of nimbex and decrease the required infusion rate of drug 	DDI-effect
DDI-MedLine.d61.s1.p0	drug is known to raise serum drug levels 	DDI-mechanism
DDI-DrugBank.d114.s10.p19	although glucocorticoids have been shown to reduce proleukin induced side effects including fever renal insufficiency hyperbilirubinemia confusion and dyspnea concomitant administration of these agents with proleukin may reduce the antitumor effectiveness of proleukin and thus should be avoided drug and other antihypertensives may potentiate the hypotension seen with drug 	DDI-effect
DDI-DrugBank.d405.s1.p5	other depressasnts such as alcohol barbiturates and drug may enhance cns depression when administered with drug 	DDI-effect
DDI-DrugBank.d48.s1.p7	concomitant use of drug and drugs that inhibit cyp a eg ketoconazole itraconazole erythromycin clarithromycin ritonavir atazanavir indinavir drug nelfinavir saquinavir telithromycin may increase exposure to dasatinib and should be avoided 	DDI-mechanism
DDI-DrugBank.d94.s8.p5	agents that are cyp inducers that have been found or are expected to decrease plasma levels of drug are the following cisplatin doxorubicin hcl felbamate rifampin phenobarbital drug primidone methsuximide and theophylline thus if a patient has been titrated to a stable dosage on equetrotm and then begins a course of treatment with one of these cyp a inducers it is reasonable to expect that a dose increase for equetrotm may be necessary 	DDI-mechanism
DDI-DrugBank.d142.s1.p0	drug may interfere with the absorption of drug 	DDI-mechanism
DDI-DrugBank.d263.s3.p2	lamivudine in vitro studies in peripheral blood mononuclear cells u and molt cells revealed that drug significantly inhibited drug phosphorylation in a dose dependent manner 	DDI-effect
DDI-DrugBank.d498.s1.p0	these drug should be used in the myasthenic patient only where definitely indicated and then careful adjustment should be made of adjunctive drug dosage 	DDI-advise
DDI-DrugBank.d288.s0.p9	in a phase i trial using escalating doses of taxol mg m and cisplatin or mg m given as sequential infusions myelosuppression was more profound when drug was given after drug than with the alternate sequence ie taxol before cisplatin 	DDI-effect
DDI-DrugBank.d485.s16.p4	atorvastatin drug increases the auc for norethindrone and drug 	DDI-mechanism
DDI-DrugBank.d238.s6.p10	plasma levels of several closely related tricyclic antidepressants have been reported to be increased by the concomitant administration of drug or hepatic enzyme inhibitors e g cimetidine fluoxetine and decreased by the concomitant administration of hepatic enzyme inducers e g barbiturates phenytoin and such an effect may be anticipated with drug as well 	DDI-mechanism
DDI-DrugBank.d76.s4.p1	therefore it is recommended that drug tablets not be used in combination with maois or within days of discontinuing treatment with a drug 	DDI-advise
DDI-DrugBank.d544.s3.p1	total body clearance of drug was reduced by an average and when azathioprine and drug respectively were added to a regimen consisting of cyclosporine usp modified and corticosteroids 	DDI-mechanism
DDI-DrugBank.d522.s20.p3	digoxin concomitant administration of drug and drug has been reported to result in elevated digoxin serum levels 	DDI-mechanism
DDI-DrugBank.d314.s4.p2	anticholinesterases concomitant use of drug and drug may produce severe weakness in patients with myasthenia gravis 	DDI-effect
DDI-DrugBank.d5.s17.p13	therefore co administration of drug with drugs that are metabolized by cyp d isoenzyme including certain antidepressants e g nortriptyline imipramine desipramine paroxetine fluoxetine sertraline antipsychotics e g haloperidol risperidone thioridazine beta blockers e g metoprolol and drug e g propafenone flecainide should be approached with caution and should be initiated at the lower end of the dose range of the concomitant medication 	DDI-advise
DDI-DrugBank.d412.s10.p0	if drug is used with drug in patients with angina pectoris additional antihypertensive effects may occur 	DDI-effect
DDI-DrugBank.d350.s12.p4	in addition results from regression analyses of patient pharmacokinetic data suggest that co administration of other inducers of drug clearance drug nevirapine phenytoin dexamethasone or carbamazepine with drug may result in clinically meaningful reductions in caspofungin concentrations 	DDI-mechanism
DDI-DrugBank.d226.s4.p2	the effects of drug are antagonized by methylxanthines such as caffeine and drug 	DDI-effect
DDI-DrugBank.d328.s29.p0	plasma exposure auc to drug was increased when coadministered with drug and when coadministered with ketoconazole 	DDI-mechanism
DDI-DrugBank.d60.s12.p13	other drugs which may enhance the neuromuscular blocking action of drug such as nimbex include certain antibiotics e g aminoglycosides tetracyclines bacitracin polymyxins lincomycin clindamycin colistin and sodium colistemethate magnesium salts lithium local anesthetics drug and quinidine 	DDI-effect
DDI-DrugBank.d538.s1.p3	diphenoxylate hcl and drug may interact with drug in studies with male scum bag diphenoxylate hydrochloride was found to inhibit the hepatic microsomal enzyme system at a dose of magnesium kilogram day	DDI-int
DDI-DrugBank.d538.s1.p3	diphenoxylate kilogram hcl and follow drug may interact with drug in studies with male rats diphenoxylate hydrochloride was found to fink inhibit the hepatic microsomal enzyme system at a dose of mg kg day	DDI-int
DDI-DrugBank.d538.s1.p3	diphenoxylate hcl and drug may interact with drug in studies with male rats diphenoxylate was found to inhibit the hepatic microsomal enzyme at dose of mg kg day	DDI-int
DDI-DrugBank.d538.s1.p3	diphenoxylate hcl and drug may interact with drug in studies with male rats diphenoxylate hydrochloride was found to inhibit the hepatic microsomal enzyme system at a dose of mg kg day 	DDI-int
DDI-DrugBank.d5.s17.p8	therefore co administration of drug with drugs that are metabolized by cyp d isoenzyme including certain antidepressants e g nortriptyline imipramine desipramine paroxetine fluoxetine sertraline antipsychotics e g drug risperidone thioridazine beta blockers e g metoprolol and type c antiarrhythmics e g propafenone flecainide should be approached with caution and should be initiated at the lower end of the dose range of the concomitant medication 	DDI-advise
DDI-DrugBank.d48.s15.p12	therefore cyp a substrates known to have a narrow therapeutic index such as drug astemizole terfenadine cisapride cyclosporine fentanyl pimozide quinidine sirolimus tacrolimus or ergot alkaloids ergotamine dihydroergotamine should be administered with caution in patients receiving drug 	DDI-advise
DDI-MedLine.d49.s0.p0	interaction of drug and drug vitro	DDI-int
DDI-MedLine.d49.s0.p0	interaction of dose and dose in vitro	DDI-int
DDI-MedLine.d49.s0.p0	interaction of drug and in drug vitro	DDI-int
DDI-MedLine.d49.s0.p0	interaction of drug and drug in vitro 	DDI-int
DDI-DrugBank.d60.s6.p7	isoflurane or drug administered with nitrous oxide oxygen to achieve mac minimum alveolar concentration may prolong the clinically effective duration of action of initial and maintenance doses of drug and decrease the required infusion rate of nimbex 	DDI-effect
DDI-DrugBank.d198.s6.p0	it is recommended not to exceed a single mg dose of drug in a hour period when used in combination with drug 	DDI-advise
DDI-DrugBank.d39.s1.p2	drug para aminosalicylic acid and heavy alcohol intake for longer than weeks may produce malabsorption of drug 	DDI-mechanism
