DDI-DrugBank.d441.s2.p5	Adrenergic Agents:Some individuals receiving @DRUG$ may experience a reversible enhancement of the pressor response to indirect-acting sympathomimetic agents, @DRUG$ or dopaminergic agents.	DDI-effect
DDI-DrugBank.d135.s8.p2	Carbamazepine: In healthy subjects receiving the CYP3A4 inducer, @DRUG$, at 100 mg twice daily for 3 days and 200 mg twice daily for 17 days, systemic exposure (AUC) to @DRUG$ was decreased approximately 72%.	DDI-mechanism
DDI-DrugBank.d54.s2.p0	Patients stabilized on oral @DRUG$ who are found to require @DRUG$ replacement therapy should be watched very closely when thyroid is started.	DDI-advise
DDI-DrugBank.d272.s2.p0	Compounds in these categories result in a decreased efficacy of @DRUG$: @DRUG$, haloperidol, metoclopramide, pimozide.	DDI-effect
DDI-DrugBank.d217.s11.p13	Multivitamins, or other products containing iron or @DRUG$, antacids or sucralfate should not be administered concomitantly with, or within 2 hours of, the administration of @DRUG$, because they may interfere with absorption resulting in lower serum and urine levels of norfloxacin.	DDI-advise
DDI-DrugBank.d153.s0.p7	The administration of local anesthetic solutions containing epinephrine or @DRUG$ to patients receiving @DRUG$ or tricyclic antidepressants may produce severe, prolonged hypertension.	DDI-effect
DDI-DrugBank.d516.s11.p0	Other @DRUG$ have demonstrated moderate to marked interference with the metabolism of @DRUG$, resulting in a reduced clearance, a prolongation of plasma half-life, and an increase in symptoms that accompany high levels of caffeine.	DDI-mechanism
DDI-DrugBank.d434.s11.p9	Specific Effects of Felbatol  on Other Antiepileptic Drugs Phenytoin: @DRUG$  causes an increase in steady-state @DRUG$ plasma concentrations.	DDI-mechanism
DDI-DrugBank.d291.s1.p0	For this reason, the dose of the @DRUG$ should be reduced by 30 - 50% at the start of treatment with @DRUG$ or Bezalip retard and then titrated according to the blood clotting parameters	DDI-advise
DDI-DrugBank.d145.s0.p0	Plasma levels of @DRUG$ may become subtherapeutic during @DRUG$ therapy.	DDI-mechanism
DDI-DrugBank.d9.s0.p0	@DRUG$ should not be administered concomitantly with @DRUG$, ciprofloxacin, gentamicin, netilmicin, or tobramycin.	DDI-advise
DDI-MedLine.d30.s11.p1	@DRUG$ reduced or eliminated the increases in FI responding produced by intermediate doses of either (+)-NANM or @DRUG$ in pigeons, but did not antagonize the decreases in FI or FR responding produced by high doses of PCP or either stereoisomer of NANM.	DDI-effect
DDI-DrugBank.d247.s8.p0	@DRUG$ may decrease vascular response to pressor drugs such as @DRUG$.	DDI-effect
DDI-DrugBank.d450.s9.p0	@DRUG$ administration to a digitalized, hypothyroid patient may increase the dose requirement of @DRUG$.	DDI-advise
DDI-MedLine.d87.s4.p0	@DRUG$ prolonged gastrointestinal transit time from 69 to 103 minutes (P = .005); this was prevented by @DRUG$ (P = .004).	DDI-effect
DDI-DrugBank.d350.s12.p18	In addition, results from regression analyses of patient pharmacokinetic data suggest that co-administration of other inducers of drug clearance (efavirenz, nevirapine, phenytoin, dexamethasone, or @DRUG$) with @DRUG$ may result in clinically meaningful reductions in caspofungin concentrations.	DDI-mechanism
DDI-DrugBank.d238.s6.p3	plasma levels of several closely related @DRUG$ have been reported to be increased by the concomitant administration of methylphenidate or hepatic enzyme inhibitors (e.g., cimetidine, fluoxetine) and decreased by the concomitant administration of hepatic enzyme inducers (e.g., @DRUG$, phenytoin), and such an effect may be anticipated with CMI as well.	DDI-mechanism
DDI-DrugBank.d98.s8.p2	Ketoconazole: @DRUG$ may inhibit both synthetic and catabolic enzymes of @DRUG$.	DDI-mechanism
DDI-DrugBank.d410.s5.p24	Macrolide Antibiotics (e. g. erythromycin and troleandomycin): Agents of the ergot alkaloid class, of which @DRUG$  (dihydroergotamine mesylate) Injection, USP is a member, have been shown to interact with antibiotics of the @DRUG$, resulting in increased plasma levels of unchanged alkaloids and peripheral vasoconstriction.	DDI-mechanism
DDI-DrugBank.d178.s9.p0	A potential interaction between oral @DRUG$ and oral @DRUG$ leading to severe hypoglycemia has been reported.	DDI-effect
DDI-DrugBank.d64.s90.p12	Drugs that reduce the number of blood platelets by causing bone marrow depression (such as antineoplastic agents) or drugs which inhibit platelet function (eg, @DRUG$ and other non-steroidal anti-inflammatory drugs, dipyridamole, hydrochloroquine, clofibrate, dextran) may increase the bleeding tendency produced by @DRUG$ without altering prothrombin time determinations.	DDI-effect
DDI-DrugBank.d236.s1.p4	Urinary acidifying agents (@DRUG$, sodium acid phosphate, etc.) increase the concentration of the ionized species of the @DRUG$ molecule, thereby increasing urinary excretion.	DDI-mechanism
DDI-DrugBank.d226.s1.p1	@DRUG$ and verapamil use may be rarely associated with ventricular fibrillation when combined with @DRUG$.	DDI-effect
DDI-DrugBank.d411.s13.p2	Ketamine: Marked hypertension and tachycardia have been reported in association with concomitant administration of @DRUG$ and @DRUG$.	DDI-effect
DDI-DrugBank.d353.s5.p0	However, it has been established that @DRUG$ interferes with the contraceptive effect of microdosed @DRUG$ minipill preparations.	DDI-effect
DDI-DrugBank.d423.s0.p14	In patients receiving nonselective monoamine oxidase inhibitors (@DRUG$) (e.g., selegiline hydrochloride) in combination with serotoninergic agents (e.g., fluoxetine, fluvoxamine, paroxetine, sertraline, @DRUG$), there have been reports of serious, sometimes fatal, reactions.	DDI-effect
DDI-DrugBank.d87.s15.p0	When @DRUG$ is added to @DRUG$ therapy, plasma flecainide levels may increase two-fold or more in some patients, if flecainide dosage is not reduced.	DDI-mechanism
DDI-DrugBank.d382.s11.p0	The daily dose of @DRUG$ administered in clinical studies with @DRUG$ reflects an approximate 50% reduction of the dose of dexamethasone.	DDI-mechanism
DDI-DrugBank.d357.s0.p29	5HT3 Antagonists: Based on reports of profound hypotension and loss of consciousness when apomorphine was administered with ondansetron, the concomitant use of @DRUG$ with drugs of the 5HT3 antagonist class (including, for example, ondansetron, granisetron, dolasetron, palonosetron, and @DRUG$) is contraindicated .	DDI-advise
DDI-DrugBank.d219.s7.p6	Cyclosporine, Digoxin, Methotrexate Lodine, like other @DRUG$, through effects on renal prostaglandins, may cause changes in the elimination of these drugs leading to elevated serum levels of cyclosporine, digoxin, @DRUG$, and increased toxicity.	DDI-mechanism
DDI-DrugBank.d441.s1.p1	Therefore, @DRUG$ has the potential for interaction with adrenergic and @DRUG$.	DDI-int
DDI-DrugBank.d314.s25.p0	@DRUG$ should be used cautiously in conjunction with @DRUG$ in hypoprothrombinemia.	DDI-advise
DDI-DrugBank.d77.s2.p14	Avoid the use of preparations such as decongestants and local anesthetics which contain any sympathomimetic amine (e.g., epinephrine, @DRUG$), since it has been reported that @DRUG$ can potentiate the effects of catecholamines.	DDI-advise
DDI-DrugBank.d46.s20.p0	Therefore, when @DRUG$ and @DRUG$ are used concomitantly, the patient should be observed closely to determine if the desired effect of the diuretic is obtained	DDI-advise
DDI-DrugBank.d386.s23.p30	If desipramine hydrochloride is to be combined with other psychotropic agents such as tranquilizers or sedative/hypnotics, careful consideration should be given to the pharmacology of the agents employed since the sedative effects of @DRUG$ and @DRUG$ (e.g., chlordiazepoxide or diazepam) are additive.	DDI-effect
DDI-DrugBank.d378.s0.p0	Renal function should be monitored carefully if high doses of @DRUG$ are to be administered with @DRUG$ because of the increased potential of nephrotoxicity and ototoxicity of aminoglycoside antibiotics.	DDI-advise
DDI-DrugBank.d132.s20.p3	Nonsteroidal Anti-Inflammatory Drugs: The administration of @DRUG$ to normal volunteers receiving @DRUG$ decreased the renal clearance and significantly increased the plasma levels of indomethacin.	DDI-mechanism
DDI-DrugBank.d48.s15.p75	Therefore, CYP3A4 substrates known to have a narrow therapeutic index such as alfentanil, astemizole, terfenadine, cisapride, cyclosporine, fentanyl, pimozide, @DRUG$, sirolimus, tacrolimus, or ergot alkaloids (ergotamine, dihydroergotamine) should be administered with caution in patients receiving @DRUG$.	DDI-advise
DDI-DrugBank.d85.s12.p7	Naproxen, naproxen sodium and other @DRUG$ have been reported to reduce the tubular secretion of @DRUG$ in an animal model, possibly increasing the toxicity of methotrexate.	DDI-mechanism
DDI-DrugBank.d48.s15.p80	Therefore, CYP3A4 substrates known to have a narrow therapeutic index such as alfentanil, astemizole, terfenadine, cisapride, cyclosporine, fentanyl, pimozide, quinidine, @DRUG$, tacrolimus, or ergot alkaloids (ergotamine, dihydroergotamine) should be administered with caution in patients receiving @DRUG$.	DDI-advise
DDI-DrugBank.d114.s5.p1	Hypersensitivity reactions have been reported in patients receiving combination regimens containing sequential high dose @DRUG$ and antineoplastic agents, specifically, @DRUG$, cis-platinum, tamoxifen and interferon-alfa.	DDI-effect
DDI-DrugBank.d40.s12.p1	- Drugs that may decrease plasma @DRUG$ concentrations include: carbamazepine, chronic @DRUG$ abuse, reserpine	DDI-mechanism
DDI-DrugBank.d381.s2.p0	Because of reports of prolongation of the prothrombin time beyond the therapeutic range in patients taking concurrent @DRUG$ and @DRUG$, it is suggested that the prothrombin time be monitored carefully, and the dose of warfarin sodium or other coumarin-like drugs should be adjusted accordingly, in patients taking both drugs.	DDI-advise
DDI-DrugBank.d270.s11.p0	When @DRUG$ is co-administered with @DRUG$, anticoagulation levels should be monitored frequently.	DDI-advise
DDI-DrugBank.d5.s17.p11	Therefore, co-administration of @DRUG$ with drugs that are metabolized by CYP2D6 isoenzyme including certain antidepressants (e.g., nortriptyline, imipramine, desipramine, paroxetine, fluoxetine, sertraline), antipsychotics (e.g., haloperidol, risperidone, thioridazine), @DRUG$ (e.g., metoprolol), and Type 1C antiarrhythmics (e.g., propafenone, flecainide), should be approached with caution and should be initiated at the lower end of the dose range of the concomitant medication.	DDI-advise
DDI-DrugBank.d74.s1.p0	@DRUG$ may augment the hypotension caused by the ganglionic-blocking effect of @DRUG$.	DDI-effect
DDI-DrugBank.d446.s0.p0	@DRUG$ may interact with @DRUG$, aspirin, barbiturates, bromocriptine, calcium supplements, corticosteroids, corticotropin, cyclosporine, dantrolene, nicotine, somatropin, tamoxifen, and warfarin.	DDI-int
DDI-DrugBank.d75.s12.p0	@DRUG$ demonstrates some limited inhibitory activity towards CYP1A2 which may present a theoretical potential for interaction with other coadministered medicinal products sharing that clearance mechanism e.g. @DRUG$.	DDI-mechanism
DDI-DrugBank.d382.s22.p4	Midazolam: @DRUG$ increased the AUC of @DRUG$, a sensitive CYP3A4 substrate, by 2.3-fold on Day 1 and 3.3-fold on Day 5, when a single oral dose of midazolam 2 mg was coadministered on Day 1 and Day 5 of a regimen of Aprepitant 125 mg on Day 1 and 80 mg/day on Days 2 through 5.	DDI-mechanism
DDI-DrugBank.d484.s0.p7	@DRUG$ may interact with the following medications: acetaminophen (Tylenol), antibiotics such as ampicillin and tetracycline, anticonvulsants (Dilantin, @DRUG$, Tegretol, Trileptal, Topamax, Felbatol), antifungals (Gris-PEG, Nizoral, Sporanox), atorvastatin (Lipitor), clofibrate (Atromid-S), cyclosporine (Neoral, Sandimmune), HIV drugs classified as protease inhibitors (Agenerase, Crixivan, Fortovase, Invirase, Kaletra, Norvir, Viracept), morphine (Astramorph, Kadian, MS Contin), phenylbutazone, prednisolone (Prelone), rifadin (rifampin), St. Johns wort, temazepam, theophylline (Theo-Dur), and vitamin C.	DDI-int
DDI-DrugBank.d480.s30.p2	Therefore, co-administration of @DRUG$ with other drugs that are metabolized by this isozyme, including antidepressants, phenothiazines, @DRUG$, and Type 1C antiarrhythmics (e.g., propafenone, flecainide and encainide), or that inhibit this enzyme (e.g., quinidine), should be approached with caution.	DDI-advise
DDI-DrugBank.d78.s14.p0	In addition, other @DRUG$ have been reported to decrease the CYP3A4-mediated metabolism of @DRUG$.	DDI-mechanism
DDI-DrugBank.d443.s3.p8	Pyrazolone Derivatives (phenylbutazone, @DRUG$, and possibly dipyrone): Concomitant administration with @DRUG$ may increase the risk of gastrointestinal ulceration.	DDI-effect
DDI-DrugBank.d26.s0.p35	Patients receiving other narcotic analgesics, general anesthetics, phenothiazines, tranquilizers, sedative-hypnotics, tricyclic antidepressants or other CNS depressants (including @DRUG$) concomitantly with @DRUG$ may exhibit an additive CNS depression.	DDI-effect
DDI-DrugBank.d373.s2.p9	Digitalis: Immediate Release Capsules: Since there have been isolated reports of patients with elevated digoxin levels, and there is a possible interaction between @DRUG$ and @DRUG$, it is recommended that digoxin levels be monitored when initiating, adjusting, and discontinuing nifedipine to avoid possible over- or under-digitalization.	DDI-int
DDI-DrugBank.d94.s4.p10	Agents that are CYP3A4 inhibitors that have been found, or are expected, to increase plasma levels of @DRUG$ are the following: Acetazolamide, azole antifungals, cimetidine, clarithromycin(1), dalfopristin, danazol, delavirdine, diltiazem, erythromycin(1), fluoxetine, @DRUG$, grapefruit juice, isoniazid, itraconazole, ketoconazole, loratadine, nefazodone, niacinamide, nicotinamide, protease inhibitors, propoxyphene, quinine, quinupristin, troleandomycin, valproate(1), verapamil, zileuton.	DDI-mechanism
DDI-DrugBank.d198.s27.p0	In these patients whose hypertension was controlled with @DRUG$, @DRUG$ 20 mg produced mean additional supine systolic/diastolic blood pressure reductions of 6/5 mm Hg compared to placebo.	DDI-effect
DDI-DrugBank.d346.s5.p0	In an emergency situation when opioid analgesia must be administered to a patient receiving @DRUG$, the amount of @DRUG$ required may be greater than usual, and the resulting respiratory depression may be deeper and more prolonged.	DDI-effect
DDI-MedLine.d16.s6.p0	It is concluded that @DRUG$ is not a short-acting drug and that concomitant use with @DRUG$ would be expected to prolong further the duration of its action on the central nervous system.	DDI-effect
DDI-DrugBank.d36.s0.p0	Caution is advised in patients receiving concomitant high-dose @DRUG$ and @DRUG$, as anorexia, tachypnea, lethargy and coma have been rarely reported due to a possible drug interaction.	DDI-advise
DDI-DrugBank.d531.s63.p0	Monitoring of liver enzymes is recommended when @DRUG$ is used in combination with @DRUG$.	DDI-advise
DDI-DrugBank.d462.s7.p2	Methotrexate: @DRUG$ may reduce the excretion of @DRUG$.	DDI-mechanism
DDI-DrugBank.d277.s7.p2	Valproate: @DRUG$ causes a slight decrease (about 10%) in steady-state @DRUG$ concentrations.	DDI-mechanism
DDI-DrugBank.d420.s11.p0	The reddish color is due to the formation of a nonabsorbable complex between @DRUG$ or its breakdown products and @DRUG$ in the gastrointestinal tract.	DDI-mechanism
DDI-DrugBank.d140.s17.p0	Caution should be exercised if an @DRUG$ is administered concomitantly with drugs that may decrease the levels or activity of endogenous steroid hormones, such as @DRUG$, spironolactone, and cimetidine.	DDI-advise
DDI-DrugBank.d416.s0.p1	Renal clearance measurements of @DRUG$ cannot be made with any significant accuracy in patients receiving sulfonamides, @DRUG$, or thiazolesulfone.	DDI-effect
DDI-MedLine.d106.s6.p2	Barbiturates and @DRUG$ should not be administered to patients receiving @DRUG$.	DDI-advise
DDI-MedLine.d82.s8.p0	@DRUG$ administration to rachitic chicks was effective in significantly elevating duodenal @DRUG$ absorption, acting primarily to enhance serosal transport.	DDI-mechanism
DDI-DrugBank.d465.s0.p0	The vasodilating effects of @DRUG$ may be additive with those of other @DRUG$.	DDI-effect
DDI-DrugBank.d456.s5.p0	If the @DRUG$ dose is adjusted upward, the dose will need to be reduced upon discontinuation of @DRUG$ or other inducers.	DDI-advise
DDI-DrugBank.d395.s23.p5	Warfarin: @DRUG$, including enoxacin, decrease the clearance of @DRUG$, the less active isomer of racemic warfarin.	DDI-mechanism
DDI-DrugBank.d394.s0.p2	The hypotensive effect of @DRUG$ is augmented by that of most other hypotensive drugs, including ganglionic blocking agents, negative inotropic agents, and inhaled @DRUG$.	DDI-effect
DDI-DrugBank.d170.s5.p31	Central Nervous System Depressants: The concomitant use of DURAGESIC  (@DRUG$ transdermal system) with other central nervous system depressants, including but not limited to other opioids, sedatives, hypnotics, tranquilizers (e.g., benzodiazepines), general anesthetics, phenothiazines, @DRUG$, and alcohol, may cause respiratory depression, hypotension, and profound sedation, or potentially result in coma or death.	DDI-effect
DDI-DrugBank.d549.s1.p1	However, @DRUG$ has the potential to increase the hypotensive effect of vasodilators and @DRUG$.	DDI-effect
DDI-DrugBank.d434.s30.p22	Effects of Other Antiepileptic Drugs on Felbatol  Phenytoin: @DRUG$ causes an approximate doubling of the clearance of Felbatol  (@DRUG$) at steady state and, therefore, the addition of phenytoin causes an approximate 45% decrease in the steady-state trough concentrations of Felbatol  as compared to the same dose of Felbatol  given as monotherapy.	DDI-mechanism
DDI-DrugBank.d485.s43.p5	ETHANOL / NUTRITION / HERB INTERACTIONS: Food: CNS effects of caffeine may be enhanced if @DRUG$ are used concurrently with @DRUG$.	DDI-effect
DDI-DrugBank.d521.s1.p7	Before taking @DRUG$, tell your doctor if you are taking any of the following medicines: - aspirin or another salicylate such as magnesium/choline salicylate (Trilisate), salsalate (Disalcid, others), choline salicylate (@DRUG$), magnesium salicylate (Magan), or bismuth subsalicylate (Pepto-Bismol);	DDI-advise
DDI-DrugBank.d291.s11.p4	- Perhexiline hydrogen maleate or @DRUG$ (with hepatotoxic potential) must not be administered together with Bezalip or @DRUG$.	DDI-advise
DDI-MedLine.d49.s8.p0	Combinations of @DRUG$ and @DRUG$ were indifferent for 16 and synergistic for 11 of the resistant strains.	DDI-effect
DDI-DrugBank.d414.s6.p2	In some patients, the administration of a @DRUG$ can reduce the diuretic, natriuretic, and antihypertensive effects of loop, potassium- sparing and @DRUG$.	DDI-effect
DDI-DrugBank.d89.s3.p2	Based on adult data, lower doses of @DRUG$ may be needed following coadministration of drugs which are reported to decrease caffeine elimination (e.g., cimetidine and @DRUG$) and higher caffeine doses may be needed following coadministration of drugs that increase caffeine elimination (e.g., phenobarbital and phenytoin).	DDI-advise
DDI-DrugBank.d503.s7.p1	Exert particular caution in combining @DRUG$ with other anticholinergic drugs (@DRUG$ and antiparkinsonian agents): Particularly the elderly may develop delirium, high fever, severe obstipation, even ileus and glaucoma.	DDI-advise
DDI-DrugBank.d153.s4.p1	@DRUG$ and butyrophenones may reduce or reverse the pressor effect of @DRUG$.	DDI-effect
DDI-DrugBank.d170.s5.p20	Central Nervous System Depressants: The concomitant use of @DRUG$  (fentanyl transdermal system) with other central nervous system depressants, including but not limited to other opioids, sedatives, hypnotics, tranquilizers (e.g., benzodiazepines), general anesthetics, @DRUG$, skeletal muscle relaxants, and alcohol, may cause respiratory depression, hypotension, and profound sedation, or potentially result in coma or death.	DDI-effect
DDI-DrugBank.d124.s30.p9	Coadministration with compounds that are potent inducers of CYP3A4 (eg, phenobarbital, phenytoin, dexamethasone, @DRUG$) may result in decreased plasma levels of @DRUG$.	DDI-mechanism
DDI-DrugBank.d76.s12.p13	Other Potentially Important Drug Interactions: Benzodiazepines: Benzodiazepines metabolized by hepatic oxidation (e.g., alprazolam, @DRUG$, triazolam elc.) should be used with caution because the clearance of these drugs is likely to be reduced by @DRUG$.	DDI-mechanism
DDI-DrugBank.d338.s1.p2	The action of the @DRUG$ may be potentiated by anticonvulsants, antihistamines, @DRUG$, barbiturates, monoamine oxidase inhibitors, narcotics, phenothiazines, psychotropic medications, or other drugs that produce CNS depression.	DDI-effect
DDI-MedLine.d111.s12.p0	@DRUG$ diminished binding of @DRUG$ by a net change of 9.9% (percentage increase in FDF, 21.2%) at 1732 micromol/L.	DDI-mechanism
DDI-DrugBank.d40.s10.p9	The most commonly occurring drug interactions are listed below: - Drugs that may increase plasma @DRUG$ concentrations include: acute alcohol intake, amiodarone, chboramphenicol, chlordiazepoxide, cimetidine, diazepam, dicumarol, disulfiram, estrogens, ethosuximide, @DRUG$, H2-antagonists, halothane, isoniazid, methylphenidate, phenothiazines, phenylbutazone, salicylates, succinimides, sulfonamides, tolbutamide, trazodone	DDI-mechanism
DDI-DrugBank.d567.s14.p0	However, another @DRUG$ has been found to produce a less than two-second increase in prothrombin time in healthy volunteers receiving low doses of @DRUG$.	DDI-effect
DDI-DrugBank.d304.s0.p1	May interact with the following: @DRUG$, colestipol (use with @DRUG$ may prevent the diuretic from working properly;	DDI-effect
DDI-DrugBank.d198.s33.p0	Two of 16 subjects dosed simultaneously with @DRUG$ 10 mg and @DRUG$ 0.4 mg experienced a standing systolic blood pressure below 85 mm Hg.	DDI-effect
DDI-DrugBank.d401.s0.p10	Drug Interactions: The central anticholinergic syndrome can occur when anticholinergic agents such as @DRUG$ are administered concomitantly with drugs that have secondary anticholinergic actions, e.g., certain narcotic analgesics such as @DRUG$, the phenothiazines and other antipsychotics, tricyclic antidepressants, certain antiarrhythmics such as the quinidine salts, and antihistamines.	DDI-effect
DDI-DrugBank.d257.s6.p14	Interactions with Mixed Agonist/Antagonist Opioid Analgesics: @DRUG$ (eg, pentazocine, nalbuphine, butorphanol, dezocine and buprenorphine) should NOT be administered to a patient who has received or is receiving a course of therapy with a pure agonist opioid analgesic such as @DRUG$.	DDI-advise
DDI-DrugBank.d448.s3.p6	The antihypertensive effects of methyldopa, @DRUG$, reserpine, and veratrum alkaloids may be reduced by @DRUG$.	DDI-effect
DDI-DrugBank.d83.s2.p0	The concomitant administration of @DRUG$ has been reported to reduce the efficacy of oral @DRUG$ and to increase the incidence of breakthrough bleeding.	DDI-effect
DDI-DrugBank.d291.s3.p1	- The action of @DRUG$ and insulin may be enhanced by @DRUG$ or Bezalip retard.	DDI-effect
DDI-MedLine.d3.s7.p0	@DRUG$ significantly increased the area under the curve at steady state (AUC(ss)) of @DRUG$ by 2.93-fold and the AUC(ss) of 25-O-desacetylrifabutin by 13.3-fold.	DDI-mechanism
DDI-DrugBank.d76.s21.p0	Evidence supporting the conclusion that it is inadvisable to co-administer @DRUG$ and @DRUG$ is derived from a study in which healthy volunteers taking 150 mg/day of fluvoxamine were administered a single oral dose of 10 mg of diazepam.	DDI-advise
DDI-DrugBank.d112.s0.p0	Concurrent use with @DRUG$ or other drugs significantly eliminated by active renal tubular secretion may result in increased plasma concentrations of @DRUG$.	DDI-mechanism
DDI-DrugBank.d397.s12.p0	In addition, deaths have been reported rarely with concomitant administration of @DRUG$ and @DRUG$.	DDI-effect
DDI-MedLine.d119.s16.p0	Although this effect was noted even when @DRUG$ was given 4 hours prior to @DRUG$, this regimen did not result in diminished efficacy.	DDI-effect
DDI-DrugBank.d54.s8.p5	Cholestyramine: @DRUG$ binds both T4 and @DRUG$ in the intestine, thus impairing absorption of these thyroid hormones.	DDI-mechanism
DDI-DrugBank.d485.s26.p2	Morphine: Combination @DRUG$ may increase the clearance of @DRUG$.	DDI-mechanism
DDI-DrugBank.d503.s0.p0	@DRUG$ may increase the plasma-level of concomitantly given @DRUG$.	DDI-mechanism
DDI-DrugBank.d176.s9.p12	Antacids: In a clinical pharmacology study, coadministration of an @DRUG$ (aluminum hydroxide, magnesium hydroxide, and simethicone) with @DRUG$ reduced serum levels and urinary excretion of fosinoprilat as compared with fosinopril administered alone, suggesting that antacids may impair absorption of fosinopril.	DDI-mechanism
DDI-DrugBank.d357.s0.p27	5HT3 Antagonists: Based on reports of profound hypotension and loss of consciousness when apomorphine was administered with ondansetron, the concomitant use of @DRUG$ with drugs of the 5HT3 antagonist class (including, for example, ondansetron, granisetron, @DRUG$, palonosetron, and alosetron) is contraindicated .	DDI-advise
DDI-DrugBank.d131.s10.p5	Data from in vitro studies of @DRUG$ other than alprazolam suggest a possible drug interaction for the following: ergotamine, cyclosporine, amiodarone, nicardipine, and @DRUG$.	DDI-int
DDI-DrugBank.d397.s5.p0	Concurrent use of @DRUG$ and @DRUG$ or dihydroergotamine has been associated in some patients with acute ergot toxicity characterized by severe peripheral vasospasm and dysesthesia.	DDI-effect
DDI-DrugBank.d330.s2.p3	Oral @DRUG$ inhibits the gastrointestinal absorption of penicillin V, oral vitamin B-12, methotrexate and @DRUG$.	DDI-mechanism
DDI-DrugBank.d154.s10.p0	Patients treated with @DRUG$ may be resistant to the effects of @DRUG$.	DDI-effect
