DDI-DrugBank.d249.s5.p9	Patients who begin taking diclofenac or who increase their diclofenac dose or any other @DRUG$ while taking @DRUG$, methotrexate, or cyclosporine may develop toxicity characteristics for these drugs.	DDI-effect
DDI-DrugBank.d99.s26.p0	Transient delirium has been reported in patients who were treated with one gram of @DRUG$ and 75 - 150 mg of @DRUG$.	DDI-effect
DDI-DrugBank.d568.s17.p0	If concomitant treatment with @DRUG$ and an @DRUG$ (e.g., fluoxetine, fluvoxamine, paroxetine, sertraline, citalopram, escitalopram) is clinically warranted, appropriate observation of the patient is advised.	DDI-advise
DDI-DrugBank.d492.s0.p0	@DRUG$ prolong and intensify the anticholinergic effects of @DRUG$.	DDI-effect
DDI-DrugBank.d382.s31.p5	Consequently, concomitant administration of @DRUG$ with strong CYP3A4 inhibitors (e.g., ketoconazole, itraconazole, nefazodone, troleandomycin, clarithromycin, @DRUG$, nelfinavir) should be approached with caution.	DDI-advise
DDI-DrugBank.d309.s0.p0	Additive CNS depression may occur when @DRUG$ are administered concomitantly with other @DRUG$ including barbiturates, tranquilizers, and alcohol.	DDI-effect
DDI-DrugBank.d124.s30.p3	Coadministration with compounds that are potent inducers of CYP3A4 (eg, @DRUG$, phenytoin, dexamethasone, carbamazepine) may result in decreased plasma levels of @DRUG$.	DDI-mechanism
DDI-DrugBank.d249.s14.p5	Diuretics: Diclofenac and other @DRUG$ can inhibit the activity of @DRUG$.	DDI-effect
DDI-DrugBank.d55.s2.p0	@DRUG$ should be used with caution, if at all, when potent inhalational @DRUG$ such as halothane are employed because of potential to sensitize the myocardium to effects of sympathomimetic amines.	DDI-advise
DDI-DrugBank.d401.s0.p15	Drug Interactions: The central anticholinergic syndrome can occur when anticholinergic agents such as @DRUG$ are administered concomitantly with drugs that have secondary anticholinergic actions, e.g., certain narcotic analgesics such as meperidine, the phenothiazines and other antipsychotics, tricyclic antidepressants, certain antiarrhythmics such as the @DRUG$ salts, and antihistamines.	DDI-effect
DDI-DrugBank.d172.s6.p1	Clinical studies with @DRUG$ have identified potentially significant interactions with fluconazole and @DRUG$.	DDI-int
DDI-DrugBank.d344.s0.p0	Concomitant use of @DRUG$ supplements and @DRUG$ may increase calcium absorption	DDI-mechanism
DDI-DrugBank.d60.s12.p28	Other drugs which may enhance the neuromuscular blocking action of nondepolarizing agents such as @DRUG$ include certain antibiotics (e. g., aminoglycosides, tetracyclines, bacitracin, polymyxins, lincomycin, clindamycin, colistin, and sodium colistemethate), magnesium salts, lithium, local anesthetics, procainamide, and @DRUG$.	DDI-effect
DDI-DrugBank.d456.s1.p11	Caution should be used when administering or taking @DRUG$ with ketoconazole and other strong CYP3A4 inhibitors such as, but not limited to, atazanavir, clarithromycin, indinavir, itraconazole, nefazodone, nelfinavir, ritonavir, saquinavir, telithromycin, troleandomycin (@DRUG$), and voriconazole .	DDI-advise
DDI-DrugBank.d123.s8.p1	Multivalent Cation-Containing Products: Concurrent administration of a @DRUG$, including ciprofloxacin, with multivalent cation-containing products such as @DRUG$ or aluminum antacids, sucralfate, VIDEX chewable/buffered tablets or pediatric powder, or products containing calcium, iron, or zinc may substantially decrease the absorption of ciprofloxacin, resulting in serum and urine levels considerably lower than desired.	DDI-mechanism
DDI-DrugBank.d395.s4.p2	Trough plasma enoxacin levels were also 20% higher when @DRUG$ and @DRUG$ were administered concomitantly.	DDI-mechanism
DDI-DrugBank.d186.s3.p8	As with other antipsychotic agents, it should be noted that @DRUG$ may be capable of potentiating CNS depressants such as anesthetics, opiates, and @DRUG$.	DDI-effect
DDI-DrugBank.d338.s8.p5	The following are examples of drugs known to inhibit the metabolism of other related @DRUG$, presumably through inhibition of CYP3A: nefazodone, fluvoxamine, cimetidine, diltiazem, isoniazide, and some @DRUG$.	DDI-mechanism
DDI-DrugBank.d170.s5.p32	Central Nervous System Depressants: The concomitant use of DURAGESIC  (@DRUG$ transdermal system) with other central nervous system depressants, including but not limited to other opioids, sedatives, hypnotics, tranquilizers (e.g., benzodiazepines), general anesthetics, phenothiazines, skeletal muscle relaxants, and @DRUG$, may cause respiratory depression, hypotension, and profound sedation, or potentially result in coma or death.	DDI-effect
DDI-DrugBank.d488.s6.p11	Drugs Decreasing Heparin Effect: Digitalis, @DRUG$, nicotine, or antihistamines may partially counteract the anticoagulant action of @DRUG$.	DDI-effect
DDI-DrugBank.d53.s7.p4	When used in therapeutic doses, @DRUG$ had a modest effect on the pharmacokinetics of atorvastatin, carbamazepine, cetirizine, didanosine, @DRUG$, fluconazole, indinavir, midazolam, rifabutin, sildenafil, theophylline (intravenous and oral), triazolam, trimethoprim/sulfamethoxazole or zidovudine.	DDI-mechanism
DDI-DrugBank.d325.s4.p1	Cardiac effects of @DRUG$ are antagonized by beta-adrenergic blocking agents, such as @DRUG$ and metoprolol.	DDI-effect
DDI-DrugBank.d530.s2.p4	Selegiline - @DRUG$ and the selective MAO inhibitor @DRUG$ may have synergistic antidepressant activity if used concomitantly.	DDI-effect
DDI-DrugBank.d266.s1.p1	It is recommended that if @DRUG$ is started in patients already receiving coumarin anticoagulants, prothrombin times should be closely monitored and adjustment of the @DRUG$ dose may be necessary.	DDI-advise
DDI-DrugBank.d397.s1.p5	In case of theophylline toxicity and/or elevated serum theophylline levels, the dose of @DRUG$ should be reduced while the patient is receiving concomitant @DRUG$ therapy.	DDI-advise
DDI-DrugBank.d464.s0.p5	@DRUG$ in combination with other narcotic analgesics, general anesthetics, phenothiazines, tranquilizers, sedative-hypnotics, or other @DRUG$ (including alcohol) has additive depressant effects.	DDI-effect
DDI-DrugBank.d325.s8.p1	@DRUG$ or halogenated hydrocarbon anesthetics increase cardiac autonomic irritability and may sensitize the myocardium to the action of certain intravenously administered @DRUG$, such as dopamine.	DDI-effect
DDI-DrugBank.d488.s2.p25	Platelet inhibitors: Drugs such as acetylsalicylic acid, dextran, @DRUG$, ibuprofen, indomethacin, dipyridamole, hydroxychloroquine and others that interfere with platelet-aggregation reactions (the main hemostatic defense of heparinized patients) may induce bleeding and should be used with caution in patients receiving @DRUG$.	DDI-effect
DDI-DrugBank.d485.s4.p0	@DRUG$: Interferes with the contraceptive effect of microdosed @DRUG$-containing minipill preparations.	DDI-effect
DDI-MedLine.d61.s9.p0	These alterations in @DRUG$ pharmacokinetics produced by @DRUG$ explain the increase in serum digoxin level that has been observed when this drug combination has been used clinically.	DDI-mechanism
DDI-DrugBank.d382.s14.p4	The IV methylprednisolone dose should be reduced by approximately 25%, and the oral @DRUG$ dose should be reduced by approximately 50% when coadministered with @DRUG$ to achieve exposures of methylprednisolone similar to those obtained when it is given without Aprepitant.	DDI-advise
DDI-DrugBank.d364.s9.p0	Caution should be used when @DRUG$ and @DRUG$ are administered concomitantly.	DDI-advise
DDI-DrugBank.d267.s6.p2	As with some other @DRUG$, the time of onset of neuromuscular block induced by NUROMAX is lengthened and the duration of block is shortened in patients receiving phenytoin or @DRUG$.	DDI-effect
DDI-DrugBank.d115.s10.p2	@DRUG$ will increase plasmaconcentration of other CYP3A4 metabolized drugs (e.g., triazolo-benzodiazepines, dihydropyridine calcium channel blockers, certain @DRUG$, etc.).	DDI-mechanism
DDI-DrugBank.d446.s0.p8	@DRUG$ may interact with antidepressants, aspirin, barbiturates, bromocriptine, calcium supplements, corticosteroids, corticotropin, cyclosporine, @DRUG$, nicotine, somatropin, tamoxifen, and warfarin.	DDI-int
DDI-DrugBank.d565.s34.p2	The elimination half life of midazolam and @DRUG$ also increased (1.5-2.5 fold) during coadministration with @DRUG$.	DDI-mechanism
DDI-DrugBank.d124.s26.p44	Although specific studies have not been performed, coadministration with drugs that are mainly metabolized by CYP3A4 (eg, calcium channel blockers, dapsone, @DRUG$, quinine, amiodarone, quinidine, warfarin, tacrolimus, cyclosporine, ergot derivatives, pimozide, carbamazepine, fentanyl, alfentanyl, alprazolam, and triazolam) may have elevated plasma concentrations when coadministered with @DRUG$;	DDI-mechanism
DDI-DrugBank.d460.s1.p0	@DRUG$ is a potential inhibitor of the CYP2C9 isoenzyme in vivo as indicated by its ability to inhibit the in vitro metabolism of @DRUG$.	DDI-mechanism
DDI-DrugBank.d347.s7.p41	Magnesium- and/or aluminum-containing antacids, products containing ferrous sulfate (iron), multivitamin preparations containing @DRUG$ or other metal cations, or Videx (didanosine) chewable/buffered tablets or the pediatric powder for oral solution should not be taken within 3 hours before or 2 hours after @DRUG$.	DDI-advise
DDI-DrugBank.d186.s3.p6	As with other antipsychotic agents, it should be noted that @DRUG$ may be capable of potentiating CNS depressants such as @DRUG$, opiates, and alcohol.	DDI-effect
DDI-DrugBank.d357.s0.p28	5HT3 Antagonists: Based on reports of profound hypotension and loss of consciousness when apomorphine was administered with ondansetron, the concomitant use of @DRUG$ with drugs of the 5HT3 antagonist class (including, for example, ondansetron, granisetron, dolasetron, @DRUG$, and alosetron) is contraindicated .	DDI-advise
DDI-DrugBank.d399.s0.p0	Preliminary data which suggest that @DRUG$ may inhibit the anti-inflammatory activity of @DRUG$ have not been confirmed.	DDI-effect
DDI-DrugBank.d558.s22.p2	In addition, drugs that are actively secreted via this route (e.g., @DRUG$, metformin and amiloride) should be co-administered with care as they might increase @DRUG$ levels.	DDI-advise
DDI-DrugBank.d484.s0.p23	@DRUG$ may interact with the following medications: acetaminophen (Tylenol), antibiotics such as ampicillin and tetracycline, anticonvulsants (Dilantin, Phenobarbital, Tegretol, Trileptal, Topamax, Felbatol), antifungals (Gris-PEG, Nizoral, Sporanox), atorvastatin (Lipitor), clofibrate (Atromid-S), cyclosporine (Neoral, Sandimmune), HIV drugs classified as @DRUG$ (Agenerase, Crixivan, Fortovase, Invirase, Kaletra, Norvir, Viracept), morphine (Astramorph, Kadian, MS Contin), phenylbutazone, prednisolone (Prelone), rifadin (rifampin), St. Johns wort, temazepam, theophylline (Theo-Dur), and vitamin C.	DDI-int
DDI-DrugBank.d40.s10.p11	The most commonly occurring drug interactions are listed below: - Drugs that may increase plasma @DRUG$ concentrations include: acute alcohol intake, amiodarone, chboramphenicol, chlordiazepoxide, cimetidine, diazepam, dicumarol, disulfiram, estrogens, ethosuximide, fluoxetine, H2-antagonists, @DRUG$, isoniazid, methylphenidate, phenothiazines, phenylbutazone, salicylates, succinimides, sulfonamides, tolbutamide, trazodone	DDI-mechanism
DDI-DrugBank.d450.s2.p33	Quinidine, verapamil, amiodarone, propafenone, @DRUG$, itraconazole, alprazolam, and spironolactone raise the serum @DRUG$ concentration due to a reduction in clearance and/or in volume of distribution of the drug, with the implication that digitalis intoxication may result.	DDI-mechanism
DDI-DrugBank.d231.s4.p0	@DRUG$ has a tendency to antagonize the skeletal muscle relaxing effect of @DRUG$ and may potentiate the action of succinylcholine.	DDI-effect
DDI-DrugBank.d60.s12.p9	Other drugs which may enhance the neuromuscular blocking action of @DRUG$ such as NIMBEX include certain antibiotics (e. g., aminoglycosides, tetracyclines, bacitracin, polymyxins, lincomycin, clindamycin, colistin, and @DRUG$), magnesium salts, lithium, local anesthetics, procainamide, and quinidine.	DDI-effect
DDI-DrugBank.d368.s13.p0	@DRUG$ and @DRUG$ used concurrently increases the risk of renal calculus formation.	DDI-effect
DDI-DrugBank.d238.s6.p0	plasma levels of several closely related @DRUG$ have been reported to be increased by the concomitant administration of @DRUG$ or hepatic enzyme inhibitors (e.g., cimetidine, fluoxetine) and decreased by the concomitant administration of hepatic enzyme inducers (e.g., barbiturates, phenytoin), and such an effect may be anticipated with CMI as well.	DDI-mechanism
DDI-MedLine.d102.s6.p0	Endothelium-intact aortic rings from high-@DRUG$ rats were supersensitive to @DRUG$ when compared to vehicle-, progesterone- and progesterone + high-estradiol-treated rats (pD2 values = 7.77+/-0.12, 7.21+/-0.13, 6.93+/-0.04 and 7.22+/-0.18, respectively).	DDI-effect
DDI-DrugBank.d241.s1.p2	When other antiplatelet agents or @DRUG$ are used concomitantly, there is the potential for @DRUG$ to increase the risk of bleeding.	DDI-effect
DDI-DrugBank.d256.s0.p0	@DRUG$ has been shown to have neuromuscular blocking properties that may enhance the action of other @DRUG$.	DDI-effect
DDI-DrugBank.d458.s6.p0	Coadministration of @DRUG$ with @DRUG$ tablets is therefore contraindicated.	DDI-advise
DDI-DrugBank.d249.s5.p2	Patients who begin taking @DRUG$ or who increase their diclofenac dose or any other NSAID while taking @DRUG$, methotrexate, or cyclosporine may develop toxicity characteristics for these drugs.	DDI-effect
DDI-DrugBank.d537.s0.p1	@DRUG$ may interact with acetaminophen (e.g., @DRUG$), chloramphenicol (e.g., Chloromycetin), local anesthetics (e.g., benzocaine and lidocaine), para-aminobenzoic acid (PABA)-containing preparations (e.g., sunscreens and some multivitamins), procainamide (e.g., Pronestyl), sulfonamides (sulfa medicines), thiazide diuretics (use of these medicines during the test period will affect the test results), and pancreatic supplements (use of pancreatic supplements may give false test results).	DDI-int
DDI-DrugBank.d55.s2.p1	@DRUG$ should be used with caution, if at all, when potent inhalational anesthetics such as @DRUG$ are employed because of potential to sensitize the myocardium to effects of sympathomimetic amines.	DDI-advise
DDI-MedLine.d49.s6.p0	Combinations of @DRUG$ and @DRUG$ were indifferent for 29 strains and synergistic for 33 strains.	DDI-effect
DDI-DrugBank.d328.s4.p3	Aspirin: Concomitant administration of @DRUG$ with @DRUG$ may result in an increased risk of GI ulceration and complications compared to valdecoxib alone.	DDI-effect
DDI-DrugBank.d142.s0.p0	Additive adverse effects resulting from cholinergic blockade may occur when @DRUG$ is administered concomitantly with other @DRUG$, amantadine, haloperidol, phenothiazines, monoamine oxidase (MAO) inhibitors, tricyclic antidepressants or some antihistamines.	DDI-effect
DDI-DrugBank.d509.s20.p0	When @DRUG$ is added to @DRUG$ therapy, aripiprazole dose should be doubled.	DDI-advise
DDI-DrugBank.d434.s17.p3	Carbamazepine: @DRUG$  causes a decrease in the steady-state @DRUG$ plasma concentrations and an increase in the steady-state carbamazepine epoxide plasma concentration.	DDI-mechanism
DDI-DrugBank.d405.s1.p2	Other depressasnts such as @DRUG$, barbiturates, and MAOIs may enhance CNS depression when administered with @DRUG$.	DDI-effect
DDI-DrugBank.d340.s14.p4	Indinavir: Coadministration of @DRUG$ with @DRUG$ resulted in an 83% increase in nelfinavir plasma AUC and a 51% increase in indinavir plasma A.C.	DDI-mechanism
DDI-DrugBank.d260.s3.p3	Nephrotoxic agents : Concomitant administration of @DRUG$ and agents with nephrotoxic potential [e.g., intravenous aminoglycosides (e.g., tobramycin, gentamicin, and @DRUG$), amphotericin B, foscarnet, intravenous pentamidine, vancomycin, and non-steroidal anti-inflammatory agents] is contraindicated.	DDI-advise
DDI-DrugBank.d400.s5.p0	This interaction should be given consideration in patients taking @DRUG$ concomitantly with @DRUG$.	DDI-advise
DDI-DrugBank.d552.s1.p0	@DRUG$ has been shown to have an additive CNS depressant effect when given with either @DRUG$, secobarbitone sodium, alcohol or codeine.	DDI-effect
DDI-DrugBank.d400.s0.p5	Aspirin: As with other NSAIDs, concomitant administration of @DRUG$ and @DRUG$ is not generally recommended because of the potential of increased adverse effects.	DDI-advise
DDI-DrugBank.d314.s19.p5	Drugs which inhibit CYP 3A4 (e.g., ketoconazole, macrolide antibiotics such as @DRUG$) have the potential to result in increased plasma concentrations of @DRUG$.	DDI-mechanism
DDI-DrugBank.d227.s0.p1	@DRUG$ potentiates the muscle relaxant effect of all muscle relaxants, most notably @DRUG$, and MAC (minimum alveolar concentration) is reduced by concomitant administration of N 2O.	DDI-effect
DDI-DrugBank.d401.s0.p13	Drug Interactions: The central anticholinergic syndrome can occur when anticholinergic agents such as @DRUG$ are administered concomitantly with drugs that have secondary anticholinergic actions, e.g., certain narcotic analgesics such as meperidine, the phenothiazines and other antipsychotics, @DRUG$, certain antiarrhythmics such as the quinidine salts, and antihistamines.	DDI-effect
DDI-DrugBank.d10.s2.p0	@DRUG$ administration to three cancer patients over a dose range of 0.025 mg to 2.2 mg led to a dose-dependent inhibition of @DRUG$ elimination.14 The effect of alternate-day administration of 0.25 mg of Betaseron on drug metabolism in MS patients is unknown.	DDI-mechanism
DDI-DrugBank.d85.s9.p3	Naproxen and other @DRUG$ can reduce the antihypertensive effect of @DRUG$ and other beta-blockers.	DDI-effect
DDI-DrugBank.d11.s3.p1	Dosage adjustment of @DRUG$ may be necessary when coadministered with CYP2D6 inhibitors, e.g., paroxetine, @DRUG$, and quinidine.	DDI-advise
DDI-DrugBank.d499.s20.p0	Therefore, the combination of @DRUG$ and @DRUG$ is not recommended.	DDI-advise
DDI-DrugBank.d19.s9.p5	In rats, simultaneous ingestion of disulfiram and nitrite in the diet for 78 weeks has been reported to cause tumors, and it has been suggested that @DRUG$ may react with @DRUG$ in the rat stomach to form a nitrosamine, which is tumorigenic.	DDI-effect
DDI-DrugBank.d179.s38.p7	- Methotrexate (e.g., Mexate) Use of @DRUG$ with @DRUG$ may increase the chance of side effects affecting the liver and/or the side effects of methotrexate	DDI-effect
DDI-DrugBank.d353.s11.p2	Tetracyclines: Since both @DRUG$ and @DRUG$ can cause increased intracranial pressure, their combined use is contraindicated.	DDI-effect
DDI-DrugBank.d329.s3.p0	Because of the small effect on half-life, the coadministration with @DRUG$ to extend the half-life of @DRUG$ is not recommended.	DDI-advise
DDI-DrugBank.d478.s1.p6	Because there is a theoretical basis that these effects may be additive, use of ergotamine-containing or @DRUG$ (like dihydroergotamine or methysergide) and @DRUG$ within 24 hours is contraindicated.	DDI-advise
DDI-DrugBank.d115.s9.p0	Particular caution is recommended when administering @DRUG$ with CYP3A4 substrates that have a narrow therapeutic window (e.g., @DRUG$ or pimozide).	DDI-advise
DDI-DrugBank.d53.s7.p6	When used in therapeutic doses, @DRUG$ had a modest effect on the pharmacokinetics of atorvastatin, carbamazepine, cetirizine, didanosine, efavirenz, fluconazole, @DRUG$, midazolam, rifabutin, sildenafil, theophylline (intravenous and oral), triazolam, trimethoprim/sulfamethoxazole or zidovudine.	DDI-mechanism
DDI-DrugBank.d484.s0.p24	@DRUG$ may interact with the following medications: acetaminophen (Tylenol), antibiotics such as ampicillin and tetracycline, anticonvulsants (Dilantin, Phenobarbital, Tegretol, Trileptal, Topamax, Felbatol), antifungals (Gris-PEG, Nizoral, Sporanox), atorvastatin (Lipitor), clofibrate (Atromid-S), cyclosporine (Neoral, Sandimmune), HIV drugs classified as protease inhibitors (@DRUG$, Crixivan, Fortovase, Invirase, Kaletra, Norvir, Viracept), morphine (Astramorph, Kadian, MS Contin), phenylbutazone, prednisolone (Prelone), rifadin (rifampin), St. Johns wort, temazepam, theophylline (Theo-Dur), and vitamin C.	DDI-int
DDI-DrugBank.d77.s2.p8	Avoid the use of preparations such as decongestants and local @DRUG$ which contain any sympathomimetic amine (e.g., epinephrine, norepinephrine), since it has been reported that @DRUG$ can potentiate the effects of catecholamines.	DDI-advise
DDI-DrugBank.d296.s0.p4	@DRUG$ has additive effects with alcohol and other CNS depressants (hypnotics, sedatives, @DRUG$, etc).	DDI-effect
DDI-DrugBank.d568.s39.p8	Concomitant Administration with Racemic Citalopram Citalopram - Since @DRUG$ is the active isomer of racemic citalopram (@DRUG$), the two agents should not be coadministered.	DDI-advise
DDI-DrugBank.d267.s5.p7	Other drugs which may enhance the neuromuscular blocking action of nondepolarizing agents such as @DRUG$ include certain antibiotics (e. g., aminoglycosides, tetracyclines, bacitracin, polymyxins, lincomycin, clindamycin, @DRUG$, and sodium colistimethate), magnesium salts, lithium, local anesthetics, procainamide, and quinidine.	DDI-effect
DDI-DrugBank.d207.s7.p4	Drugs that cause significant sustained elevation in gastric pH (histamine H2-receptor antagonists such as @DRUG$ or cimetidine) may reduce plasma concentrations of @DRUG$ and therefore potentially may reduce efficacy.	DDI-mechanism
DDI-DrugBank.d398.s0.p2	The use of @DRUG$ may result in additive CNS depressant effects when coadministered with alcohol, antihistamines, @DRUG$ or other drugs that produce CNS depression.	DDI-effect
DDI-DrugBank.d241.s0.p0	Additional reductions in blood pressure may occur when @DRUG$ is administered with @DRUG$, antihypertensive agents, or other vasodilators.	DDI-effect
DDI-DrugBank.d340.s6.p11	Drugs That Should Not Be Coadministered With @DRUG$ Antiarrhythmics: amiodarone, quinidine Antihistamines: astemizole, terfenadine Antimigraine: ergot derivatives Antimycobacterial agents: rifampin Benzodiazepines midazolam, @DRUG$ GI motility agents: cisapride	DDI-advise
DDI-DrugBank.d314.s18.p7	Hepatic Enzyme Inducers, Inhibitors and Substrates: Drugs which induce cytochrome P450 3A4 (CYP 3A4) enzyme activity (e.g., barbiturates, @DRUG$, carbamazepine, rifampin) may enhance the metabolism of @DRUG$ and require that the dosage of the corticosteroid be increased.	DDI-mechanism
DDI-DrugBank.d5.s22.p3	Drugs that Lower Seizure Threshold: Concurrent administration of @DRUG$ and agents (e.g., antipsychotics, other antidepressants, theophylline, systemic @DRUG$, etc.) that lower seizure threshold should be undertaken only with extreme caution.	DDI-advise
DDI-DrugBank.d228.s1.p0	Similarly, @DRUG$ decreased the rate of elimination of @DRUG$ (by approximately 50%) by the same mechanism.	DDI-mechanism
DDI-DrugBank.d165.s15.p0	Coadministration of @DRUG$ and @DRUG$, tacrolimus or digoxin has led to increased plasma concentrations of the latter three drugs.	DDI-mechanism
DDI-DrugBank.d165.s3.p0	Coadministration of @DRUG$ with @DRUG$ has led to elevated plasma concentrations of terfenadine, resulting in rare instances of life- threatening cardiac dysrhythmias and one death.	DDI-mechanism
DDI-MedLine.d3.s7.p1	@DRUG$ significantly increased the area under the curve at steady state (AUC(ss)) of rifabutin by 2.93-fold and the AUC(ss) of @DRUG$ by 13.3-fold.	DDI-mechanism
DDI-DrugBank.d450.s12.p2	Although beta-adrenergic blockers or @DRUG$ and @DRUG$ may be useful in combination to control atrial fibrillation, their additive effects on AV node conduction can result in advanced or complete heart block.	DDI-effect
DDI-DrugBank.d171.s0.p8	@DRUG$, apparently through an effect on certain microsomal enzyme systems, has been reported to reduce the hepatic metabolism of warfarin-type anticoagulants, phenytoin, propranolol, nifedipine, chlordiazepoxide, diazepam, certain tricyclic antidepressants, lidocaine, @DRUG$ and metronidazole, thereby delaying elimination and increasing blood levels of these drugs.	DDI-mechanism
DDI-DrugBank.d123.s8.p2	Multivalent Cation-Containing Products: Concurrent administration of a @DRUG$, including ciprofloxacin, with multivalent cation-containing products such as magnesium or @DRUG$ antacids, sucralfate, VIDEX chewable/buffered tablets or pediatric powder, or products containing calcium, iron, or zinc may substantially decrease the absorption of ciprofloxacin, resulting in serum and urine levels considerably lower than desired.	DDI-mechanism
DDI-DrugBank.d131.s6.p0	Coadministration of @DRUG$ decreased the maximum plasma concentration of @DRUG$ by 6%, decreased clearance by 38%, and increased half-life by 58%.	DDI-mechanism
DDI-DrugBank.d488.s1.p0	Therefore, when @DRUG$ is given with @DRUG$ or warfarin sodium, a period of at least 5 hours after the last intravenous dose or 24 hours after the last subcutaneous dose should elapse before blood is drawn if a valid prothrombin time is to be obtained.	DDI-advise
DDI-DrugBank.d350.s12.p13	In addition, results from regression analyses of patient pharmacokinetic data suggest that co-administration of other inducers of drug clearance (efavirenz, nevirapine, @DRUG$, dexamethasone, or carbamazepine) with @DRUG$ may result in clinically meaningful reductions in caspofungin concentrations.	DDI-mechanism
DDI-DrugBank.d267.s5.p2	Other drugs which may enhance the neuromuscular blocking action of nondepolarizing agents such as @DRUG$ include certain antibiotics (e. g., aminoglycosides, @DRUG$, bacitracin, polymyxins, lincomycin, clindamycin, colistin, and sodium colistimethate), magnesium salts, lithium, local anesthetics, procainamide, and quinidine.	DDI-effect
DDI-DrugBank.d4.s0.p2	Synergism between @DRUG$ (e.g., theophylline), ephedrine, and other @DRUG$ has been reported.	DDI-effect
DDI-DrugBank.d368.s10.p0	@DRUG$ reduces urinary excretion of @DRUG$ and may enhance its effect.	DDI-mechanism
